idx,text,Task B
4312,im piss lambd abud is im going thi cant afford launch school send email il al,TIN
4313,did anyon watch trump talk last night what babbl idiot the look doct ey priceless com,TIN
4314,a macdonald stronghold riv castl tioram almost much sheep shit snow cun fash wal l,TIN
4315,look back rememb mr may worst ev prim min who knew,TIN
4316,blat fuel street polit neg democr civil socy formid forc involv t,TIN
4317,most intellect obsess hist archeolog discovery old lit devot myst,TIN
4318,savitr er religy fratern अलहददपर बढयबर edupr santiniket,TIN
4319,we guil tru sin sodem thi hat arrog gree inhospit vio,TIN
4320,idiot respect cult mean hat own it mea,TIN
4323,not sur peopl last 4 century cartel head francogerm bank going,TIN
4324,a depart facebook pag at point consid threat viol elect off,TIN
4326,whit if anyon describ would stand lik sor,TIN
4327,thaaaaa folk,TIN
4329,why party slash fund drug addict serv thi led many many dea try,TIN
4330,would grat someon could ask his bord delivery group speech clear thi bit isnt end,TIN
4331,sterl drop 2 euro merest hint deal imagin would hap idiot act we,TIN
4332,it disgust peopl lik che pandem,TIN
4333,cartoon dont knock til try it thought berny 2020,TIN
4334,you op mock ind journ not drop self aw i h,TIN
4336,crook hil deflect her good pal convict rap harvey weinstein he contribut every democr campaig,TIN
4337,why disdain min just anoth rac journ,TIN
4340,the travel worst affect are night viol thi in,TIN
4341,abus abus block access just hum right respect is abl provid,TIN
4342,yeah hit street,TIN
4343,rememb rempel said oil work respect wom lost shit trudeau govt ord study tash k mock,TIN
4345,war lying berny posit tot elimin superdeleg forc comprom amp leav o,TIN
4346,thi corp nat pend amp resourc ab hz kochproblem amp nam ja,TIN
4347,thi ter egypt i tel dialectth boy obvy turkest,TIN
4348,thi embarrass,TIN
4350,rememb thought 2019 shitty year,TIN
4351,cant believ got win i expect shit 00,TIN
4352,not fuck mil year,TIN
4353,lik convict rap id guess prison then epstein suicid perhap,TIN
4354,pleas do i nee pas baton someon trig sweaty gammon fac cunt,TIN
4355,fuck stat delud cow mak bibl pass coz know christian she preach hav,TIN
4357,in commun riot mob kil le guil lead cre atmosph extrem hat without,TIN
4358,berny complet fraud my hop peopl real thi,TIN
4359,now sur get promot a rajy sabh seat min thos took rout bigotry a,TIN
4360,lib lik tom stey support rep slavery driv crazy no on al today ev slav p,TIN
4361,thi intrigu who kil ankit sharm,TIN
4362,so evid destroy,TIN
4363,wowand cal u among desp nam rac,TIN
4364,al damn cathol storm com ste job wim,TIN
4365,i guess argu cult appropry although could argu anyon lie su,TIN
4366,who bor liar sur,TIN
4367,a 60 ir republ polit prison remain gaol across ireland psf ful infilt mi5,TIN
4368,class blund nev get involv land war as nev go sicil dea on,TIN
4369,he hat foreign nonwhit he just cal kil pop entir country explicitl,TIN
4370,thi smart much effect connect die link putin endless rant t,TIN
4371,seem unlik theyr busy argu about,TIN
4372,we fal victim extrem rar phenomenon known profess soothsay tripl witch 3,TIN
4373,dt barbar keeley alastair stewart strictlycomedancing len said blackpool would wors ed bal,TIN
4374,hel,TIN
4375,apart from that kid,TIN
4378,a bed lie,TIN
4379,thi ow patterson prom farm vot leav 2016 increas subsidy and kil mon,TIN
4389,act lik didnt see shit complet shat heart,TIN
4390,the rac low expect polit lik prit patel should know bet theyr ethn min t,TIN
4394,liar dont you want pun u restrict u bul u beat u submit you see,TIN
4396,cov child abus sur must crimin off,TIN
4397,look disgust conduc wok nyp report display rac conduc toward ind guy thi expos,TIN
4398,they intern ter org jihad nam allah9,TIN
4399,every on know suicid bomb jihad mind dream 72 hoor but w,TIN
4400,doesnt mean becom coward forget wound,TIN
4401,you tot disgrac put am ind lif jeopardy you const al with,TIN
4402,she ut dis,TIN
4403,muslim maj aggress hindu civil sec men kil nar antimuslim riot thi i,TIN
4404,mohammad kil jew took slav marry child claim last prop,TIN
4405,the blackmail isnt ev subtl we burn ind dont let pakistan muslim abduc kil hindu pak,TIN
4406,i almost singlehand took berny sand out tweet yesterday my respons get at but it,TIN
4407,thi crazy unfair someth nee don asap stop nonsens biolog sportswom spend ye,TIN
4417,the dog cyc,TIN
4418,list littl shit i get i didnt crawl cab patch it glam lif outsid b,TIN
4419,thread warn doesnt happy end for sham,TIN
4420,the thing assert eug work anim it fuck doe not work for anim wev inbr,TIN
4421,i see damn andrew sabisky situ going away i writ two book eug rac teach,TIN
4422,who blon de dumb now,TIN
4423,fuck the sun fuck everyon work the sun fuck every dribbl react fuck shith buy st,TIN
4424,hous cat real giv on singl shit,TIN
4425,you complet idiot beyond parody,TIN
4426,yo talk us soc nonsens fool on,TIN
4427,al polit liar,TIN
4429,match day folk celt v copenh shown liv tavern ev kick com hoop,TIN
4430,ocon ir bar liv sunday kick 12 noon bar op 1130 aberdeen v celt celticfc,TIN
4432,we walk away now it going get nasty,TIN
4434,wrong amp terr sad,TIN
4435,bef ment il left took bbc,TIN
4436,girl nee warn fak muslim boyfriend asyl seek child rap groom gang kept secret scot pol,TIN
4437,no guess i am i kil on problem,TIN
4438,pat wond could put mass tool box,TIN
4439,shamsu iqb us posit hom off fals pap investig found 437 cas fak docu o,TIN
4440,the ful horr tru auth fail gen victim sex abus stil,TIN
4441,when going us ful forc law high plac guil misconduc publ,TIN
4443,sen fail pas prol bil ass licens kil mor 140 baby surv abort outsid womb l,TIN
4447,soc kil far peopl vir push evil on,TIN
4448,soc kil far peopl vir dumb on,TIN
4453,becaus ess blam eu shit com tricky do,TIN
4454,the real u insurancebas healthc busy no wond keen destroy ou,TIN
4457,i think im los itt,TIN
4458,berny sand may cal denmarklov democr soc commun spearhead dangerou,TIN
4459,berny nev apolog defens commun thug hel nev apolog heart them it,TIN
4464,preserv u left wing pervert polit judg guil enco abus child,TIN
4466,and serv wis men decid lif dea,TIN
4467,thi hap world nowsometim tot ballard sometim tot dick,TIN
4468,look agr piplup piec shit,TIN
4469,it i real giv shit i try funny,TIN
4470,fuk you mikebloomberg what put u risk up bitch lik think money mak you,TIN
4471,top notch investig ful expos ukraineg see common sens podcast corrupt,TIN
4472,bloody hel i cant decid who dumb 19k idiot rtd thi sad parody account she,TIN
4473,ok i sick of thes arrog ahol who is thi look shak head snotty smirk he,TIN
4474,the black commun nee stand for presid a black busy own veg get it it,TIN
4475,conrad black if sand is nomin trump wil tak about 65 of the vot trump coattail wouldinstal a,TIN
4476,wel go my dream own marijuan queendom smok im afr americ,TIN
4477,say aint joe you mad story you know dem go around mak bul crap story get aw,TIN
4478,say aint joe you mad story you know dem go around mak bul crap story a,TIN
4479,fivewordfairyt thi democr party dont walk away run socialismkil democratshateameric htt,TIN
4480,black fac rac tan hah,TIN
4481,hah stupid,TIN
4482,oh shit dawg forgot that much diff vinyl red,TIN
4483,what fuck problem fuck cunt,TIN
4484,yo fuck weird cunt man,TIN
4485,sil may alway answ fool auth story dont let fool nar,TIN
4486,if beat slip broom belt charg mop stick turn stick forget it you hav,TIN
4487,the pow boob,TIN
4488,too many peopl confus freedom speech say stupid shit,TIN
4489,rahh pop smok got kil man every 2 week someon els smh,TIN
4490,the brit nev teach kid tru evil nat colon brit enslav kil mi,TIN
4491,absolv disgust serv schiphol airport 55 minut stood immigr queu thi isnt,TIN
4492,it act look lik fuck mak rid thorp park sent end olymp,TIN
4493,fam tim i thought stil fin the shard that splintered effect top look soo shit,TIN
4494,educ know right fact diseas spread ign peopl think cant hap the,TIN
4495,the cod kil,TIN
4496,what pretty annoy zimbabw laugh peopl lik chinotimb mak fun instead hol,TIN
4497,to lady bust ass half opportun men do im real sorry 2020 aft,TIN
4498,ful respect,TIN
4499,fil em venom elimin em godzillachalleng on who spit it repost got priz my,TIN
4501,big shit,TIN
4502,talk garb,TIN
4504,il show min show yo,TIN
4505,not everbody dav stormzy thank fuck aspir stab ne,TIN
4506,liverpoolseasy get hold say lik refug camp already sizeliverpool,TIN
4507,oh fuck word stun no i dont want nud im try get fril,TIN
4508,jes christ,TIN
4509,sue lif must very fuck empty,TIN
4511,any polit preach war drug push vap ban hypocrit many blind by,TIN
4512,en effet il sagit bien de ter,TIN
4514,fat mistak country assum get coronavir who chief,TIN
4516,thos peopl attack victim vil rap asham th,TIN
4517,her go anoth apolog pakistan muslim rap old deflect tacticsnot religy,TIN
4518,thi ut ridic tran peopl nee sport ev enough,TIN
4519,the left nev admit mass immigr biggest singl issu effect every on publ serv,TIN
4520,you grad a moron,TIN
4521,how let country get terr stat capit city end useless ter,TIN
4522,can mak yorkshir tea pancak hand lefty,TIN
4523,what ment retard left say now,TIN
4524,and tim eith prep walk away bad deal tha,TIN
4528,labo ful toss lik brain cel connect,TIN
4529,al bias lefty teach head teach princip,TIN
4533,ent vict london world rac poverty abus injust amp crim lot it the vict detect h,TIN
4534,believ everyth hear hahah the rom us scrape dirt strigil,TIN
4535,i going cal chick theres justsay,TIN
4536,start grow vegyou could keep chick too mayb pig could cal bor,TIN
4537,they op mou lie fal out,TIN
4538,pas sick bag,TIN
4541,il 2020 sarà il mio anno lo sento rischio di un terz guerr mond inter paes che bruciano pap fran,TIN
4542,i complet stun waltermitty think stupid enough believ maj gen serv,TIN
4543,anoth day anoth disgust antisemit tiktok video mock holocaust,TIN
4544,must annoy liv near that,TIN
4545,westminst abus claim pol party turn blind ey polit institut fail respond hist cl,TIN
4551,thi problem nutshel jud reform stop judg curb gov enact wil peopl weak,TIN
4554,the sarcasm drug,TIN
4557,idiot uk withdraw europ arrest war,TIN
4558,bor crack law ord control immigr bbccivil s,TIN
4560,a ban city trad org tory black whit bal the fin serv auth rul jay,TIN
4561,rac long derog label rac day mean you refus supportvo,TIN
4562,i guess wer becom aw rac label doesnt mean us mean i,TIN
4564,anoth idiot labo mp say abl immigr speak engl red her,TIN
4565,too busy tory black amp whit bal rais ev money wealthy party ha,TIN
4566,hon kil on brut crim hum occ throughout arabmuslim world the arab,TIN
4567,can imagin lif kind left wing nut job they would suck fun everyth,TIN
4570,right enough enough fuck paolo nutin,UNT
4571,thi problem peopl blam eu immigr when along w,TIN
4572,wel doesnt nee vot year doesnt giv damn,TIN
4573,find someon els upst bro hahahah i aint on hahah you would kil shit you model on,TIN
4574,fortun nev hap cant believ scumb stil 2020,TIN
4575,do cong sex drink tea mak midnight feast,TIN
4576,sham peopl lik,TIN
4578,fuck,UNT
4579,the dem est could list megadon amp try destroy but end if theyr concern a,TIN
4580,why dont fuck ask him you know lik job,TIN
4581,break the sil israel soldy rev dai atroc commit israel occup forc palestin,TIN
4582,snp act kil child sex fil,TIN
4583,anyon tak sery horseshit wev hear what putin want want sow chao amp weak dem t,TIN
4584,yet anoth artic guard dea booksnovelswritingliteratureetc pretend ebook and,TIN
4586,the inept hit job prit patel hallmark off class revolt peopl bury kid due knif,TIN
4588,what hel why,TIN
4589,it v progress damnedest fuck progress candid,TIN
4590,how fuck democr the democr party chang nam immedy,TIN
4591,al democr est ant prim mak kind obvy on de,TIN
4592,oh yeah scum,TIN
4593,granddad pronount commun lik common fuck idiot,TIN
4595,imagin many peopl u think i may vir could kil me but i cant afford car,TIN
4598,tot derang gammonopol,TIN
4600,we know liar now how get rid him,TIN
4601,thi trump solv caronavirushoax,TIN
4603,what find offend bril labo wom lik lou lucian forc o,TIN
4605,wait oh shit mom priceless,TIN
4606,the govern consid anyon earn 25600 unskil work thes hand cur,TIN
4607,soc car screwed hau amp food process screwed farm screwed travel amp tour sect screwed nh sc,TIN
4608,putin leaf doubt offend idlib continu he ign cal ceasefir amp access humanit help,TIN
4610,bbcdn watch moron excus pervert devy prim school amaz quick scot fu,TIN
4612,sad old git get invit,TIN
4613,for cant ment rac,TIN
4614,com country cult whos est rif fraud noon wh,TIN
4615,no ridic infantil point mad,TIN
4616,form bbc pres michael sout jail 22 year sex abus sev boy two decad,TIN
4619,how stupid ar how dar ber loc smal busy seem bit amp vindict,TIN
4621,if u whit peopl lik would stil mud hut chuck spear ea,TIN
4622,it ridic nh spend 100m transl 128 langu 5 yr that could buy a,TIN
4624,mor peopl die cold rel il uk anywh els europ tory ev cut old,TIN
4626,al msm work pm circ governmentbecaus shit scar los we,TIN
4628,tory consist murd cit decad 690247 ris dai delib cu,TIN
4629,prittipatelav prison,TIN
4631,bor johnson slap watchdog fals claim univers credit mir onlin,TIN
4633,what arrog littl prick,TIN
4635,who car trump tax plan also kil budget,TIN
4638,ja ev de bul wat lucht gev,TIN
4639,what kind horr hum handcuff six year old what kind disgust hum stand whild chil,TIN
4640,exceiv epstein kil himself,TIN
4644,uk would ins let chlorinated chick farm say chlorinated chick illeg eu uk if to,TIN
4645,for century let u build ram mandir now kil u put jai sri ram stick vehic they liv,TIN
4646,such shameless scum rajdeep is see try put word mou peopl interview is,TIN
4653,yep i know mean devil advoc if the,TIN
4654,it also reason pop rear ug head wh,TIN
4655,noon advoc ful soc though democr soc,TIN
4656,yeah u held nos vot the,TIN
4657,hav readlook deal eu mad turkey l,TIN
4658,im sorrydid bomb country refug cam from,TIN
4659,ten year ago bor johnson soc lif would ruin car he don quit wel himself the t,TIN
4663,thi fuck ghast real bor johnson britain many peopl im afraid dad surv mu,TIN
4665,chick com hom roost elect nasty party,TIN
4666,he trait tri treason nehru progeny,TIN
4667,devil reincarn emerg lair,TIN
4668,the moron attempt align sect antieurop vot publ swift mov,TIN
4669,he talk keny lik that,TIN
4670,my believ sociopath rich west look putin corrupt kleptocr man democr a,TIN
4671,bor johnson let judg scrap eu rul protect sick pay holiday hor j,TIN
4672,shut pomp condescend git,TIN
4686,neighbo bor johnson fath who shot estrang wif died ind suspect murd su,TIN
4687,los seren william,TIN
4688,chicago judg remov lock child courth jail cel teach lesson,TIN
4689,i found someon i nev wann los that,TIN
4691,vit tackl unconscy bia myth suicideprev 164 174 peopl 95respondents pol suicid,TIN
4692,we gav unprec access docu provid honest op look lif ins,TIN
4693,dea suicid ros 109 uk 2018 in uk highest suicid rat among men ag 45,TIN
4695,if dont lik sim ejac city street broad daylight yo evil hat amp homophon,TIN
4696,if piss civil serv someth right dont let bastard grind pr,TIN
4697,so many rac,TIN
4700,thi isnt gestapo kgb thes mod r thug break muslim hom pil amp assault impun,TIN
4701,ut disgust stay fortnight ago smart met instal nev show schedule wa,TIN
4702,insid 25 bil bal top tory sel access bor johnson thi johnson instead cobr m,TIN
4707,mor peopl died coronavir ita ir bug spread sev new county acro,TIN
4708,when wil every singl hum being recogn that progress lib ar al pervert sex devy amp pred to var,TIN
4709,deep stat er hold beyond evil er hold tweet disturb warn trump coronavir,TIN
4710,it perfect cant corrupt crook polit i think it bril,TIN
4712,sometim say idiot thing a bord amp wal ess pandem sanctu city amp homel,TIN
4715,thi is wors than the coronavir 2 mil child ar kidnap a year for sex traffick,TIN
4716,im black busy own in la veg who employ black hisp amp wom the black commun nee to stand up for,TIN
4718,let see introduc stupid bil go commit might pas go ful hous might pas go t,TIN
4720,yo rhet mak ear ey blee yo known liar youl,TIN
4721,russ hoax fail muel investig fail ukrain fail impeach fail coronavir somehow trump fault,TIN
4722,bil clinton fir 93 ag on day thi wom crazy,TIN
4723,im too wet 18 year old get fuck orgasm 6ucof27s2u us u e porn porno muguruz,TIN
4724,my as dry it much it hurt stoppleas jvn1c21o2g l us j h porn porno sen,TIN
4725,doubl hug cumshot fac hot blowjob sex cuty jkso2f7fi2 h us porn porno brexit,TIN
4727,o cours tak forev get spee i sold stupid pomp numpty rol cutandshut job fit,TIN
4728,o cours tak forev get spee i sold stupid pomp numpty rol cutandshut job fi,TIN
4730,hav missold brexit which lie con you thes lie farm uk believ,TIN
4731,in 5th richest country world graham em body weigh 28kg 62lb discov bailiff,TIN
4732,it becom clear every day country head tot disast if get trad deal eu dam,TIN
4736,if bor johnson go back ni protocol amp custom bord ir sea consequ stop any,TIN
4738,the think crazy seem we influ seat tabl deal maj p,TIN
4740,now that fuck sad,TIN
4742,go study the transgend process and get back to me juny,TIN
4743,the bjp goon hindutv trol tweet ready idiot,TIN
4745,i tot agr thi,TIN
4748,shit gonn hit fan now they bring army rest ord thi templ country,TIN
4750,you cannot rehabilit jihad ter want kil you he hid fact right up,TIN
4751,go bor,TIN
4756,aw suicid off sou kore just min report took lif jump han riv die,TIN
4757,beid tap old propagand playbook battl coronavir outbreak the problem lead thi tim,TIN
4758,runin pleas oh pleas let enquir high volum act fuck mind,TIN
4759,diss orthodox view opin thi fuck eug it,TIN
4761,the europ research group a ded band bit rac semicorps respons ut shitstorm i,TIN
4762,concern about dick for dick dismit genuin publ concern fac recognit tech appal,TIN
4764,it com surpr bor johnson aid ord send short brief memo tha,TIN
4765,pleas dont equ moron engl im appal absolv noth common bellend,TIN
4767,mad poland dutchfrench company a mag trick distract rob blind it ok los,TIN
4768,jew chronicle pay dam gross antisemit libel far right march how stupid how boneh,TIN
4780,word fail me americ ful gull fuck,TIN
4781,a thread peopl stil think tory aust kil peopl a smal select heartbreakin,TIN
4782,pier fuck morg tweet say horrend carolin flack commit suicid spend lit,TIN
4783,in spit court ord block deport jamaica50 flight stil took off what hap rul o,TIN
4784,in determin push ahead today deport govern lay bar rac cruel that,TIN
4785,bor johnson tel parlia gulf lif expect rich amp poor narrow conservat,TIN
4786,it embarrass quick nar shift jess phillip clar cal fem lead to,TIN
4789,lik it the on thing il ev do lik it the on thing il ev do lik it the on thing il ev do lik i,TIN
4790,i would real lik know peopl mak fak cal mak sound real,TIN
4793,thi real ey op,TIN
4795,the secret stat intern trad lady amp gentlem thes dissembl clown get held bet account t,TIN
4796,he lit try get fuck straw yal 12 yr old get horny man o,TIN
4798,wann see nial soooooooo bad,TIN
4799,i alway think it lik go match grandad screaming abus bil ful,TIN
4800,ah fuck you on kid,TIN
4801,block carol dont know seem lik dick,TIN
4802,sorry bad langu horr cunt thread,TIN
4803,tot jok polit,TIN
4804,we hav got enough pol deal real crim she clown right sho,TIN
4805,i dont mind head last night plac lik excit kid,TIN
4806,thi guy lit sav hour lif guy rip,TIN
4807,exact i feel peopl mak easy sex offend,TIN
4808,sery say noth that ridic com,TIN
4809,what fuck going,TIN
4810,why lie,TIN
4811,mass migr whit country purpos plan glob elit illuminat zion thi con,TIN
4812,throughout europ cal democr peopl ign cens peopl pr,TIN
4814,get pow solv homeless cris cunt,TIN
4815,you fuck gammon moron we deport muppet lik you,TIN
4816,ye let black kil muslim step body domin,TIN
4817,cred europ court hum right lie ruin judg link soro rev ht,TIN
4818,bloody ludicr,TIN
4819,rac cunt,TIN
4820,shit didnt real gangst sorry bruv,TIN
4821,lit anyon tory,TIN
4822,ug baby chelse shirt trump support yo clear rac m,TIN
4823,i thought ten point clear top celebr ridic roy kean impress wit,TIN
4824,spoil theyr overpr shit,UNT
4825,lucky london switch party nonsens yo fuck mat,TIN
4826,you ridic dont real work coronavirusus coronavir trumpisam,TIN
4828,thi man dang fool he kil real peopl ign stupid sci coronavir,TIN
4829,hey impot sad watch whit hous a crimin disgust liar a divid destroy,TIN
4830,we cant let trump lying ign amp overwhelm crimin wear u down i know debilit that wha,TIN
4831,americ nee sci sciencemat mad stupid coronavir,TIN
4832,that problem much bad terr hap peopl forget so thank hel remind,TIN
4833,thi man dang fool trumpisadisgrac trumpisamoron sciencemat,TIN
4834,mor heavy rain today west yorkshir mor flood lik mor hom busy commun devastated r,TIN
4835,to vict belong spoil happybrexit,TIN
4836,you ridic dont real work coronavirusus coronavir,TIN
4841,yo 14 point must real shit thenlik stuff labo po,TIN
4842,look famy hom volunt unemploy lik it stupid ful,TIN
4843,it absolv disgust report jud process apply carolin flac,TIN
4844,hit 2m stream defenceless,TIN
4850,throwback fuck legend kick rac cunt gam i could watch day,TIN
4851,now every fuck know u specky bastard feel it ham genuin view,TIN
4852,simunov trash,TIN
4853,im man rang i cant win fuck titl i guess that guy known real merry christmas,TIN
4854,imagin going traum sex abus rap sex exploit liv devast lif chang si,TIN
4857,ir threatens flog anyon caught spreading coronavir lie,TIN
4858,instead destroy wildl nurt it cher every amaz anim nat imagin,TIN
4860,que ser de nosotro sin tanto pendejo haciéndono fel sig as,TIN
4861,govern expery inflict brain dam monkey terr fak snak spid ten of mil,TIN
4867,hat see,TIN
4868,the km podcast sitcom fuck lov,TIN
4869,it clear blind spot org if continu,TIN
4870,video show uniform plaincloth pol off brut arrest young black coupl subway car ful pe,TIN
4871,pet buttigieg try pretend giv shit un poc sou carolin go wel they lit,TIN
4873,msnbc plan to seek smart prosand voic amid crit cov network execut tel,TIN
4874,sham review absolv nonsens blanket ban everywh ment al surpr,TIN
4875,bet od ign theyr lit plac eurovid,TIN
4876,fat peopl 2020 yeah im fat fault it coronavir fault,TIN
4877,vot doubl hour im sur euroscoreboard plenty fak ac,TIN
4878,guess i post bullshit,TIN
4879,break bor johnson tel eu hel walk away negoty tabl jun it clear he going get c,TIN
4880,damn it gonn hard compet gif guess il follow thatgirl party,TIN
4881,patriot that tim ev u depl get drink on if want rid bad as p,TIN
4882,sham capitol hil lib attempt fault adequ pr,TIN
4883,sham capitol hil lib attempt fault adequ,TIN
4884,i lik it jeff a downhil trump trainhav rol hrc i fbap show psy,TIN
4885,berny sand world class fraud charl if yo fal b routin hav don homework,TIN
4886,who biggest as donkey auct,TIN
4887,thi absolv noth comp old housem thought it rain men israel men,TIN
4889,eug back it stil stupid a thread doct,TIN
4892,off fig 2019 found 19k child gang rap victim pakistanibrit muslim gang convict hit 27 uk city p,TIN
4893,schrödingers rac middl class whit men simult deny ex claim expery,TIN
4895,i think i understand mot peopl mor sur cant real self amp stupid to,TIN
4896,thi nudg pol design push wav vot,TIN
4897,thi is my prim min part or ful tim amaz speech today bojo reply disgust,TIN
4899,dont buy fuck sun,TIN
4900,i see scum blood hand lg x,TIN
4901,hel fuck ye,TIN
4902,what the act fuck strictly view,TIN
4903,that poor lady walk speak up victim blat corrupt council a,TIN
4904,should person found pervert cours just delib cont submit evid crimin,TIN
4905,pleas address issu innoc ppl prison would help prev selfharm amp suicid prison read let,TIN
4906,not fit for purpos you ruin lif corrupt fail giv ppl fair tri lo,TIN
4907,sam her court clerk corrupt dismit let mcken,TIN
4908,trait al erg fan,TIN
4909,mayb prit fac al,TIN
4911,wtf slip headbut ur as mistak,TIN
4912,fuck tiny dick,TIN
4913,im fuck simp proud,TIN
4914,acc lookin sick tbh,TIN
4915,no deal then moron,TIN
4917,you sad bitch play rac card seem it thing day it cal cry wolf,TIN
4918,i nee get fee ut crap mak blood boil,TIN
4919,how stupid ar it meg play rac card certain queen ar,TIN
4920,it fortun know wom fking idiot let loos socy,TIN
4921,a far im aw eu left big hol fund ask remain memb stu,TIN
4922,dt dian johnson alastair stewart the 2nd sery kil ev fin shoot downton abbey the,TIN
4923,comp contrast war polit sens aw her exact lib both sid shit that,TIN
4924,concern thing rlb mak ment clim refug rac plan handl thos,TIN
4925,dunno mayb fund shit on 85 margin seat thought,TIN
4926,i remain ut confus fuck nam progress med org the young turk giv,TIN
4927,us i say someon kil i mean fig,TIN
4928,thi protest bought paid eco ter it arson attempt murd reckless endang of,TIN
4929,if say work hard head may explod who fuck kid arrest detain jail fin rep,TIN
4930,thi crimin act so arrest,TIN
4931,defac publ mem pol off kil lin duty is canad becom,TIN
4932,trudeau extrem concern ter not going anyth it exceiv pract extrem,TIN
4933,how fuck consid tak wom tv,TIN
4934,yh he peic shit he anyth els,TIN
4935,it rac surpr peopl vot peopl hat them poc tory sel out,TIN
4936,the tory real antisemit cunt,TIN
4937,the peopl led disgust charg hodgewatsonsmeethstreetinget alwil b,TIN
4940,old dian abbot say put threat rap i feel noth fear,TIN
4941,oh fuck off no on car think you buddy blair spec plac hel wait fo,TIN
4942,ant brexit ant bor ant trump ant democr bbc scum show tru colo absolv disgrac it nee,TIN
4943,not publ interest shit u rememb gav stonk majorit,TIN
4944,dick burg talk absolv bollock us 10 mil extr immigr last decad impact nh o,TIN
4945,wer deal crook liar fraud,TIN
4946,is man genuin stupid good act,TIN
4948,let rep thi if young support zanu pf stupid moron,TIN
