idx,text,Task B
0,scot med if cov story includ rap sex assault abus pleas includ detail h,TIN
1,kil the poor,TIN
2,wom interest think disgust wom us publ toilet includ sink cle me,TIN
3,anny wel idiot mamp idiot,TIN
4,ye exact thi it bad law forc wom pow mal lobby group us hurt attack wom,TIN
5,thi might ridic thing ev heard courtcomplet absurd hop,TIN
6,indee cas walk press box cal u a bunch fcking liar stil sent,TIN
7,chin mobl whol govern whol socy comb coronavir u going let complet incom,TIN
8,bor for sal superrich don paid hundr thousand pound access bor johnson top min,TIN
9,refus allow honest fuck un get fuck kne lad,TIN
10,and cas jol jack tar 77brigade typ say that load shit,TIN
11,what disgust show cur lib democr ar how could stay quiet whilst know on a,TIN
12,shock abus of moth child muslim shop own slap fac custom think d,TIN
13,when going run story blind ey turn pakistan groom gang bbc new blind ey turn t,TIN
14,do support left wing bigot,TIN
15,islamophob word cre fasc us coward manip moron phob mean ir noth ir,TIN
16,ryanair bos spark fresh fury refus withdraw claim muslim men lik bomb plan my wif m,TIN
17,as men who think mean thi ther ind wom chines wom say as men pakistan may,TIN
18,the uk nee get rid fan promot dea western socy peopl do not dith and delay,TIN
19,rap trig warn rap is rap period the next person imply wom bring sex assault upon,TIN
20,isnt tim lik cens he spout divid promot rac tend aim whit and,TIN
21,im rais 3 teen 2 boy 1 girl il fuck turn wok snowflak gen oh shit no ge,TIN
22,the brit fuck digust rac im absolv rag becom sham polit plat,TIN
23,twat cal dav brits2020 sing about rac giv cov l,TIN
24,i real annoy peopl think anyon speak islam extrem rac it cal p,TIN
25,they cam sou as help rebuild britain the rac saw back,TIN
26,ov 200 mil muslim cal ind hom widespread antimuslim mob viol kil least 27 ind many mo,TIN
27,so may see first tim ign incompet narcissist psychopa presid deal real,TIN
28,bas stupid ar smart think vic vers,TIN
29,got cal liar cnn acc cit report est get touchy talk about,TIN
30,trump best known liar thi hug problem hold press conf reass am a,TIN
31,on gre thing 2020 amp ful est pan sand unmask end lie part,TIN
32,i didnt crit pre trump pathet inadequ fund request i not incompet plan to,TIN
33,1short thread berny immigr bottom lin incred ful shit he is,TIN
34,thi trol berny staff soo mess up not bot act peopl exhaust disgust also anyon,TIN
35,he may think rap anyon rap isnt act opin thing,TIN
36,worst pm ev,TIN
37,thes peopl stick borissound lik idiot us stick trump,TIN
38,wowso poor die,TIN
39,just aw dead he al wel giv shit run th,TIN
40,peopl talk load bias crap bbc us,TIN
41,boycot duk wellington pub not hil a young black barm rac abus attack 6 whit men he,TIN
42,at trump campaign adv say soc suck warn republ must stop t,TIN
43,you hat shitty hid camer gotch crap wright publ spac speak fre amongst peer in ne,TIN
44,pretend giv damn coronavir bet hop cent americ inf,TIN
45,immigr custom enforc confirm man arrest charg rap 11yearold girl un,TIN
46,what poor whit peopl amp ther many poor whit peopl poorest par,TIN
47,americ get ful dos extrem he glor commun cub amp he cal lead,TIN
48,watch intern med pul punch cal mod commun fasc unleash ind amp pogrom delh d,TIN
49,i condemn attack muslim ind reject viol bigotry religy intol the u stat departm,TIN
50,thi whol vulg bothsid fals equ busy disgust me som mod upset musl,TIN
51,som peopl upset muslim peac allow kil hom torch l,TIN
52,kapil mishr jail said rupesh bathl businessm say known mr mishr sint teen,TIN
53,thi isnt syr iraq thi ind rad hindutv polit norm bjp amp r thug,TIN
54,you blind hat yo lie reflect dead conscy the protest peac two,TIN
55,at tim delhiburn hom min amit shah fail bring peac delh he left peopl die lik butch a,TIN
56,i doubt littl doubt us polit spy polit esp exfb bos ra,TIN
57,most yo see congress coronavir tot unsery rhet democr try dam,TIN
58,to cathol follow i too im sur al i find absolv hypocrit a,TIN
59,famy lif decad commun hel me get told hor story dai lif western classm,TIN
60,hel no i would spank tak thing them and let know play outsid thes,TIN
61,democr talk point bad if vir disappear tomorrow would say rea,TIN
62,omglik tot,TIN
63,phil haney friend amp patriot he target knew islam ter coverup he ins li,TIN
64,he murd brief presid obum hil suicid,TIN
65,what crit rememb democr stupid peopl also get vot what dang that,TIN
66,nev trump er acceiv hat trump hat us he don nearperfect job pot we could no,TIN
67,why would i step away yo los her lol but im bor ign so long los trumppence2020,TIN
68,damn kristy brut clap back,TIN
69,assum ther proof tweet idiot,TIN
70,she couldnt stay awak long enough kick anyon as she prob,TIN
71,melany whit hous she first lady what stupid quest ask,TIN
72,thi damn inform obam hil joe amp hunt bid thi presid,TIN
73,1988 berny nak soviet un drank at fellow commun poor russ wait lin decid,TIN
74,the correct quest is who giv damn,TIN
75,that almost look lik black passport i part colo blind,TIN
76,the scum newspap publ artic today mock carolin flack valentin card thi kind bul why,TIN
77,that sad on hel in his wif 101 mem,TIN
78,so bbc antibrexit bloody hil,TIN
79,is anyon channel in charlton heston end origin planet ap today damn al,TIN
80,big heart the group cal u remo trait i think so stev and gre sor,TIN
81,balfo decl crim crim it repres worst rac act britain pow structure ev commit,TIN
82,so many palestin peopl kil the soul amp body israel cit sacr say neftal bennet a,TIN
83,in apartheidisrael on soul amp body israel cit sacr say neftal bennet,TIN
84,pity stupid man,TIN
85,i suspect hum cho thi celebr jew prid thi celebr aparth,TIN
86,and go anyon wear burkh muslim cov fac yet,TIN
87,we commit protect publ amp keep dang ter offend street end a,TIN
88,a new optout system org don england due go liv 20 may 2020 thi chang could see 700 ext,TIN
89,in july 2018 bor i david dav resign chuckchequ aft much difficul divid in,TIN
90,emerg legisl block autom ear releas peopl convict ter off becom law re,TIN
91,pap tim support divid brexit deal back known patholog liar breakerofprom johnso,TIN
92,david steel complain he crit cov rap child let clear he fail rep,TIN
93,fre speech cov incit rac hat,TIN
94,troubl nev sur he spout crap uk spee limit set the,TIN
95,now david dimbleby label bor liar bbc show sign understand ang disappoint out,TIN
96,bor johnson decid huaw rol uk 5g network could view hist worst decid brit,TIN
97,allow chines firm huawe provid part new nat telecom network worst intellig decid,TIN
98,so i got ban cal holocaust deny mothefuck soft cock iv found bunch rav naz,TIN
99,if hat immigr yo rac xenophob get upset hear diff langu bus at,TIN
100,bad bbc decid shut victor derbyshir fion bruc qt job mak t,TIN
102,black peopl four tim lik stop search pol west midland,TIN
103,back old school handswor gramm round tabl discuss pupil crim issu affectin,TIN
104,not ment ant woodland itl destroy along god know many vil,TIN
105,thes com wronghead econom illit hs2 poor valu money far mor,TIN
106,the democr party hijack screeching soc rant intersect whatev hel they,TIN
107,i hop he plac dumb lib med the cost keep,TIN
108,they gag but overt rac cancel own,TIN
109,most dang ant whit rac troublemak al guil incit rac hat 1 ash sark 2 afu hirsch,TIN
110,we epidem mal suicid country young men tak lif mp want to,TIN
111,conserv del again emerg law block ear releas ter giv roy ass two fing c,TIN
112,hypocrit,TIN
113,oh paul yo going look real sil com crash down,TIN
114,i saw ear lit unbeliev not ment deeply upset it beyond san thi,TIN
115,scum,TIN
116,bastard thi no excus nee right,TIN
117,pig intellig dog yet pig on abus anim planet goveg animalright try,TIN
118,i fear worst man a road accid cia spons bullet extrem rar almost unheard cant,TIN
119,a loudmouth unintellig react i despair tot,TIN
120,thes piglet slow starv dea stack lik trash the pil shrink go veg h,TIN
121,a hat joaquin,TIN
122,tru barb and gluttony lif smash amp destroy ter unleash fat bastard gorg amp becom u,TIN
123,bastard sick mind,TIN
124,thi on nail,TIN
125,liz war compuls liar shitty campaign of cours im enjoy watch peopl proclaim progr,TIN
126,the cia bust ship cocain lowincom black commun journ gary web back 80,TIN
127,a dying polit cent rerun stal old campaign demon soc but capit crash ineq ecolo,TIN
128,wil stand palestin peopl struggle freedom wil refus sil israel,TIN
129,not gonn ment fuzzy al qaed ter idlib sand desp whitewash terroristster wh,TIN
130,peopl lik ign symptom flu or coronavir continu work lack 1 sick leav 2 good heal ins,TIN
131,colomb in 2019 tot 36 massacr kil 133 peopl highest fig record sint 2014 humanrig,TIN
132,omg the coronavir flood it almost lik bor doesnt car go 25bn tory bal,TIN
133,stop trump socal deal charact apartheid say 50 concern europ lead form for,TIN
134,the est dem polit claim believ trump fasc dict ex threat republ,TIN
135,fiann fail uturn rent freez who would ev trust clown,TIN
136,i hop grasp ug cur process woolwich crown fort mak the,TIN
137,the determin 70yearold ir wom get just abus suff child magd laundry lik,TIN
138,ther delud ther tot rock fger clear lat,TIN
139,driv bad rich idiot the lamborghin govern indee,TIN
140,and peopl ask quest giv tax pay fund asshol,TIN
141,nev brought it nev acceiv freeby had hat as block year ago iblockedthesun,TIN
142,it fasc charg bbcqt amp stir enough hat amp bia peopl giv,TIN
143,becaus fasc charg bbcqt stir enough hat amp bia peopl giv cra,TIN
144,jes thi shit pul get trump read stuff that put nam re,TIN
145,mod bosano putin erdog etc the way punch illegitim chang caus collaps po,TIN
146,country it idiot vot nev exp,TIN
155,candym candym candym if i die candym,TIN
156,whit peopl tak land peopl money cult everyth fuck els cant tak jok im mut thi,TIN
157,to quot a kid dy black kil sweet new and he whit giv chant,TIN
158,handcuff six year old black girl school whilst cry am pol absolv mess rac see,TIN
159,part feel sorry laur fox but part rememb tweet shit lik th,TIN
160,omg i know hel,TIN
161,why black man would mock anoth rac lik beyond me i dont think ban it it,TIN
162,israel world jewry gre friend guy brought party found lit form naz aust,TIN
163,i wish whit journ gaslight min tel u rac isnt issu would tak tim o,TIN
164,you okay you may feel lik shit yo mind might beat up you may think going mak it but,TIN
165,if teach becom bloody stupid point educ system,TIN
166,by intern crimin mean islam ter no thought not,TIN
167,it seem easy mak corbyn look stupid,TIN
168,i believ tak piss,TIN
169,dont lov label rac moron lik nandy pand new parasit friend lik mat a,TIN
170,i said many tim chines gov hid real tru coronavir victim the ful story eventu,TIN
171,rac,TIN
172,wel stupid surpr ther,TIN
173,what stupid thing say stormzy dav hard gre rol model glor hat bit viol,TIN
174,foreign aid nee stop it ridic nev reach peopl nee spend needy enough,TIN
175,a thick pig shit wom fal pregn swim pool ev without penet via,TIN
176,that told mr may i lik cal ant brit rac bait idiot,TIN
177,whit brit girl held prison as groom gang 12 year forc 8 ab,TIN
178,what sham the hat he sint on appear quest tim ridic but typ left think it,TIN
179,iq rac mmmmm,TIN
180,why sick someth,TIN
181,the class polit harry pot extrem fuck it mak sens poverty ex you,TIN
182,imagin want vot prissy littl knowital lik herm fuck grang first al second metapho,TIN
183,coronavir dea rat hug unev spread accord ear study 4n,TIN
184,wel im fuck bawl again thi presid,TIN
185,a sham brain week old cot chees though,TIN
186,the coronavir worst glob pandem sint baby shark is die,TIN
187,didyouknow postofficet victim stil suff disgust apologyno clearout of,TIN
188,didyouknow postofficet victim stil suff disgust apologyno clearout board,TIN
189,in 1933 germ arrest beat tort soc democr,TIN
190,it tak long enough grow beard il damn im shav off id rath paty zero than,TIN
191,you know said convers govern den tre infecty diseas mor problem amon,TIN
192,hat horr shit stir sect screaming potato,TIN
193,i real dont understand it fuck hard peopl put dish dishwash thursdaythought,TIN
194,ar drunk congress they get paid wast tim shit mayb shou,TIN
195,he commun christ sak shouldnt investig collud russ cub,TIN
196,stayawayfrompeoplewho dog doesnt lik,TIN
197,stayawayfrompeoplewho tox narcissist exampl,TIN
198,wil coronavir dea u excess 150 mil gun dea sint 2007 report joebid thursdaythought,TIN
199,democr would rath destroy country see trump success coronavir thursdaythought,TIN
200,that deb i thought clown show ha anyon admit bid funny farm yet t,TIN
201,what whit peopl,TIN
202,joe bid com across extraordin stupid extrem annoy unlik,TIN
203,how many stupid thing bid say famy friend dnc interv get ment help demdeb,TIN
204,bid said gun viol kil 150 mil peopl sint 2007 he embarrass democr demdeb,TIN
205,joe crazy,TIN
206,the left wail i corrupt elect system giv away much money meas 20,TIN
207,dick dick,TIN
208,dick trumpderangementsyndrom,TIN
209,dick trumpdementiasyndrom,TIN
211,fat mistak country assum get coronavir say who chief,TIN
212,too tir argu stupid peopl sil thing,TIN
213,hah ongkianm raky feel betray al malay chines rest celebr depart dap from,TIN
214,we spend lif let world tel u ar san ins saint sex addict hero vict,TIN
216,in ful speech mod try stop awaw,TIN
217,common known gpi gen paralys of the ins caus worm lik bacter blood stream known a,TIN
218,quit correct louvain word lun us felt ment il rel wax,TIN
219,just anoth part nwo glob agend cred europ court hum right lie ruin judg link,TIN
220,mor sick video abu ghraib prison tort pod am us mobl bacon try get jabril talk h,TIN
221,good new sex slav front capt,TIN
222,syr refug hack pregn wom dea machet germany via wil we see thi,TIN
223,hel back prison tim,TIN
224,the left angry as man drink yorkshir tea as men rap yorkshir child most od,TIN
225,until eu maf real wer long going bul theyl continu off u trash deal attempt,TIN
226,the emerg law cre stop ear releas ter prison clear parlia hur,TIN
227,you ut moron if hat country much f o im sick virtu signal rac chuck word around a,TIN
228,let reject them now get crap ide already left nee hold nerv eu,TIN
229,new law prev ter leav prison ear going challeng court the law plac far much,TIN
230,jes christ much suppos tak beyond ridic,TIN
231,i agr entir that the disgrac shameless bbctv new report ful suppos suff muslim show,TIN
232,if want sum increas unh nat polit deb on sent sue shout t,TIN
233,thes scum prison ship get sent back fil rid shit hol instead allow,TIN
234,thi destroy europ mad,TIN
235,his pri tot ridic he seem tot oblivy publ concern cur level vi,TIN
236,fat,TIN
238,dec shit sam nois feat,TIN
239,it end tear somewh she block boyfriend post anoth nigg,TIN
240,know who is wor it and fuck who aint periodt,TIN
241,cle boyfriend room mak cheap wann wif if hat dirt hat it,TIN
242,i know stop ronaldo i told play foul juvent play insid box i think enough,TIN
243,useless board,TIN
244,ant johnlock,TIN
245,no shit sherlock the girl wa u wtf they want to fre u with them they want u to see the world with them,TIN
246,lik i dont see problem theyr teach sleep stud harass kid yo mad bc she hap,TIN
247,millen millen thing ant chin scumvillainselfsavingsystem scumvillain shenqingqiu shangqinghu,TIN
248,let hop dont get drag lik on whit gay,TIN
249,lion king lord of the ring attack on tit birdbox crossov as mv,TIN
250,his cheek heat dumb as think as cheek first bdkcndkfnen,TIN
251,nobody stop put littl found bro,TIN
252,spreading aw indig and whit peopl latin americ educ nonl,TIN
253,thi shit new iv seen many tim and know bear brunt breath shit,TIN
254,peep tri subt threaten job nam whit,TIN
255,want unedit vert carpool karaok might yoonjin say shit back car pleas ht,TIN
256,i pract rom cathol cons phys assist dea,TIN
257,a cathol know god fool say heart god see me the four,TIN
258,im rac i avoid group display bad mor,TIN
259,christ divid on memb suff suff on memb hono a,TIN
260,week ago going die world war 3 trump kil soleiman which scheduled tak plac,TIN
261,lis nandy think mal rap ident wom sent wom prison thi psychot ther,TIN
262,tel u again kil with her kil clinton rankedin morefrom convict rap harvey weinstein,TIN
263,i want good deal but im wto way eu ridic demand now poss tory backstab,TIN
264,2800 peopl worldwid kil coronavir 0 peopl americ kil coronaviru,TIN
265,not fuck penny i chip remov illeg immigr though i chip remov crimin,TIN
266,cred europ court hum right lie ruin judg link soro rev,TIN
268,thi man think adult sex child alway harm why writ sex educ manifesto for,TIN
269,if cant mock relig mock any,TIN
270,yo fulltim shit brain,TIN
272,laur fox stood told tru on brav men told lik put lefty coward t,TIN
273,bloody marbl eu trad talk uk prep walk away jun enough progress,TIN
274,absolv smash new see black whit govern walk away talk jun progress not,TIN
275,the eu us every trick book imho ess bor walk away negoty amp start sery,TIN
276,we nee stand shit brussel eu sink amp want britain bail,TIN
277,mr putin ther mayb sort,TIN
278,lov ppl support antisemit rac homophob bul,TIN
279,fair transp end corrupt much ask democr it in solid,TIN
280,so hel mayb publ peopl vot lack transp dodgy polit,TIN
281,esp charg chil blow journ amp publ work expos sery hum right abus,TIN
282,with head low and ey avert israel rac and the hono robertpeston,TIN
283,nowh hid say b a we tak anoth slic 2020 glob gdp forecast the downward revisio,TIN
284,u pre trump risk to am peopl from covid19 is very low ready to do whatev we hav to if vir spread,TIN
285,johnson would lov fac starm he fac beat men lik lif johnson fear fac,TIN
286,no brit peopl sleep street moron lik keep vot tory mistak believ al,TIN
287,if op select could get rid dead weight mp lik replac bril on li,TIN
288,erm ballot memb agr polit dob idiot unlik sharehold company get say,TIN
289,which on mak anyon els murd,TIN
290,what evid hand hand comb,TIN
291,why would self confess liar pers herself espec prospect 25k from,TIN
292,can confirm wip rins hand,TIN
293,her is label victim child abus disturbedwh hel,TIN
294,that polit kerry he f b useless tory p,TIN
295,tory blair pleas fuck off,TIN
296,they could becom endang specy tory lord get way co want poor kil eat them,TIN
297,david blunket brought bil cut benefit asyl seek tak child away car be,TIN
298,nasty fat fuck,TIN
299,and sea pollut caus fairy bottom gard lift manhol cov shit,TIN
300,israel bulldoz attack palestin protest kufr qaddom vil amp push hug rock toward narrow mi,TIN
301,a desp rag continu spread dai mess vindict hat pag if country wha,TIN
302,you got tory lord say poor kil eat grey squirrel anoth say liv street lo,TIN
303,me i tweet fool said it aint someon els mak look lik ffs,TIN
304,nasty smug bitch,TIN
305,doe includ 150000 kil 137 servicem died shop doorway,TIN
307,just lik clim cris mag cureal ful impl every left wet dream,TIN
308,we tot complet shut bord coronavir contain thi nat sec an,TIN
309,what beg dead glob epidem ha hand am polit med elit mut polit,TIN
310,imagin much asshol bloomberg cringeworthy,TIN
311,her thing i understandit lik dem want admin fail vir do know o,TIN
312,joebid i prom mak sur ther black wom suprem court transl wel judg next nomin,TIN
313,the med attack trump coronavir absolv ridic giv behavy last week crit,TIN
314,just cal pandem partyus vir infect body polit pathet effort tar pre trump wat,TIN
315,trump cruel amp divid her hop recess brought vir sick amp poss kil gre man,TIN
316,yo circ clown stop fight it you want thi,TIN
318,introduc disgust left he act blam mik penny outbreak aidsh indian he real,TIN
319,thi terr decid los access europ databas sec tool mak whol uk le,TIN
320,delh burn market set fir journ attack two peopl already kil som say mor thousand,TIN
321,thi rac far right extrem norm legitim thi vil unh rant pack ful li,TIN
322,yeah on buy burn phon ev it con,TIN
323,liv tv grimsby foodbank us said back bor deport jamaic said vot tory ge19 wolverhampton flood,TIN
324,hunt crock shit,TIN
325,target destroy,TIN
326,so shar detail immigr enforc lik youv don past,TIN
327,rev pm new aid mad vil claim wom sex reddit,TIN
328,ut guff propagand word salad asham,TIN
329,hey ar cas rac or coward rac behind someon back you tol fuck,TIN
330,he sick is someth at how feel blood child hand just com the,TIN
331,i dont nee black presid gay presid fem presid what i desir effect presid i,TIN
332,hug doct charg 145 felony rel child porn qanon thes peopl sick,TIN
334,no offens stupid enough vot gas tax,TIN
335,i dont hear laugh i hear sat bellow soul,TIN
336,ther enough drug alchohol planet could ev convint creepy joe fit pot i,TIN
337,when democr mak sens i tru believ ment il,TIN
338,sham go vir right anoth resist rac,TIN
339,stupid,TIN
340,stop sex child,TIN
341,study find school sex ed program lik plan par just mak kid hav mor sex study found neg,TIN
342,she dumb bitch,TIN
343,just saw guy smartphon drink smart wat driv smart car look lik dumbass,TIN
344,berny sand outright cal israel prim min benjamin netanyahu react rac appeas antisemit,TIN
345,mik bloomberg hav gun yo hom put you risk nra backtheblu it risk im wil tak,TIN
346,rac bitch,TIN
347,i lit told mon ago coronavir fuck scam tank econom attack presid trump,TIN
348,stud worst typ dreg socy d,TIN
349,somebody bloody mak hap pleas,TIN
350,dont sorry let bul get down we know theyr terr o,TIN
351,tear tent absolv disgust langu fasc incit mob viol,TIN
352,mor bullshit lie jc4pm forthemany,TIN
353,not ev that it bloody lie start fin,TIN
354,i know mean it shit jes play whit guy,TIN
355,is someon widdl bit jeal,TIN
356,cock,TIN
357,oh shit dud im sorry try sery,TIN
358,unless point germany lost ww2 fuck fasc manip,TIN
359,nat che a fuck fasc en cunt leaf the country for a few week,TIN
360,but fuck fasc en cunt i agr ridic reward peopl point o,TIN
361,shameless plug if want whol unabridg vert found blog her,TIN
362,how neop end absolv worst aesthet,TIN
363,the govern fuck corp fuck we fuck we going help,TIN
364,cyst the hom lif maniac supervillain p11,TIN
365,cyst the hom lif maniac supervillain p21,TIN
366,cyst the hom lif maniac supervillain p20,TIN
367,cyst the hom lif maniac supervillain px6,TIN
368,cyst the hom lif maniac supervillain px8,TIN
369,cyst the hom lif maniac supervillain px7,TIN
370,sex in spac,TIN
371,jes say go hel coronavir,TIN
372,wash hand infect touchscreen addict pol publ transport vehic sh,TIN
373,asio bunch absolv idiot whod rath foc cat compens cit torm,TIN
374,not ment nonsens malt hop shal remain malt lik hop plagu w,TIN
375,enjoy dea glob goodfornoth trait what right prop,TIN
376,noth letterboxnoth handnoth bank accountmost incompet intellig commun t,TIN
377,if cant del monet dam recipy who dumb enough wil becom assocy yo,TIN
378,no meet prearrang tim plac stupid entrap attempt cant stupid industry tak reject,TIN
379,ment il everywh mindless robot glu smartphon obey command foreign jurisdict,TIN
380,aust jurisdict leg aid auth useless databas admin thi kind auspol,TIN
381,you recov ment il tim u dict lif thi kind auspol,TIN
382,you want compens we giv stupid treas hunt you los decad street thi kind auspol,TIN
383,chines pol cannot win cas chines army nee both leg process we ter anywh thi kind auspol,TIN
384,we tak softw ide softw careerw giv attempt entrap stupid car path transl,TIN
385,you gott feel priv equ theyv ran country rap,TIN
386,not ter irregul cit,TIN
387,you complet idiot i guess nat issu attend to,TIN
388,lik trudea entir govern incompet design,TIN
389,ir deputy heal min get vir kor cris respons coordin kil himself off good start,TIN
390,the hat contempt i know bound,TIN
391,unbeliev the left kil job first hand out the west,TIN
392,cant fight stupid fact,TIN
393,canad ter threat nam justin,TIN
394,mayb schiffface new impeach charg clear trump believ god collud him,TIN
395,transl fn lead nee solv u mayb ford get op help sav as,TIN
396,hug kiss cash if remov barricad ask remov again,TIN
397,plan step 1 fig donut buytough decid clown print mak might go a,TIN
398,lib plan just kil western develop sav nat un colony 1,TIN
399,hey go try shit chin russ stop meddl affair noth an,TIN
400,useless old nag step show,TIN
401,money talk bullshit tak two plan everywh him,TIN
402,no shit real girl anatom speakingkil wom sport justiceg,TIN
403,putin trump,TIN
404,you want know somebody going do look theyv whol lif barack obam,TIN
405,sery quest bor pow fir cum,TIN
406,min refus releas secret brexit study believ show littl gain trad deal u as,TIN
407,oh dear sham turn old 1966 uk high court decid noth eu al i,TIN
408,perry my adv anybody deal bor ev famy memb get writ hel real hath f,TIN
409,uk med depict thorough dec man monst monst acceiv pm now liv con,TIN
410,say rac sack empty word johnson apolog rac launch investig,TIN
411,sham i nev thought uk would stoop thi and think corbyn vil rac pass sil,TIN
412,my first out shadow min fco team labo quest govern sil turkey attempt to,TIN
413,lesb pow word it denot clear set sex desir bound someth wom hist b,TIN
414,damn,TIN
416,lol stand bed wet lefty boycot,TIN
421,imajin devast anct thes poor peopl republ going mag grandp pop up,TIN
422,show fact fig somehow l doubt unless anoth country start hand fre hom benefit,TIN
423,can vot ban idiot,TIN
425,poor dog,TIN
426,dont let door slam as go l bet 1 go 2 b,TIN
427,vil rac,TIN
428,and dead dog grab,TIN
429,trump speak lik episod southpark crap mou liarinchief,TIN
430,dead,TIN
431,garb,TIN
432,imagin fuck pow cat must feel,TIN
433,it friday sum check 2020 lin rock every singl,TIN
434,he garb,TIN
435,i wont watch anoth gam theyr going mak look lik stupid ea sport video,TIN
436,classless dont punch guy who lay ic,TIN
437,thi autonom boat eat trash pow 100 cleanenergy cle 50000 kg debr day tim to,TIN
438,it us both tv show would cast conserv ign bigot hypocrit thos fals port,TIN
439,sand israel netanyahu react rac run country would unprec u nomin wi,TIN
