idx,text,Task B
1957,yo husband fir u attorney exceiv on soon took off 1993 stop act lik it,TIN
1958,so anoth plan dumb nev see light day it wond los,TIN
1960,damn good job not on dem rep dem candid form dem staff said on thi,TIN
1961,i born nicaragu my par liv ther my husband born cub castro amp orteg corrupt antiam m,TIN
1962,a murd dict get absolv credit famy lik min fled commun cub ar going to,TIN
1963,that mov dalla oklahom disgust,TIN
1964,100 watson fac just many lif ruin,TIN
1965,prit patel ug prejud crit superb about tim somebody cal out p,TIN
1967,the ter offend restrict ear releas bil giv roy ass act parliam,TIN
1968,thursdaythoughtsteamzay itsallaboutthedogsmax cardiff dog hom,TIN
1969,thursdaythoughtsteamzay itsallaboutthedogsoakley cardiff dog hom,TIN
1970,thursdaythought teamzay itsallaboutthedogsgeorg cardiff dog hom,TIN
1971,thursdaythoughtsteamzay itsallaboutthedogsdeano cardiff dog hom,TIN
1972,thursdaythoughtsteamzay itsallaboutthedogsarchy cardiff dog hom,TIN
1973,dwp fac leg act man starv dea benefit stop,TIN
1975,you amp press mat malign dec honest man 4 year solid end cnts eat shit a,TIN
1978,i went pol i 16 noth hap unfortun victim sex abus recount,TIN
1979,block stupid wom,TIN
1981,if govern worry wast pap could releasetherussiareport pdf form on,TIN
1982,dont remind lik damn tak dat first,TIN
1983,stuff lik hap dai dav talk rac country ther nat out why so,TIN
1984,what phys react stupid lov within first 2 mon 2020 fed year imagin rihan,TIN
1985,g as thigh talmbout im bottom girl yo scarf,TIN
1986,canna ars bomboclart bipol shit everyday ya know,TIN
1987,pop smok died wtf,TIN
1988,yo idiot,TIN
1989,i dont get peopl stupid,TIN
1990,dont step stomp bitch,TIN
1991,that us hap yo friend baddest bitch,TIN
1993,what going brain bul how watch tv affect body im and bet task we,TIN
1995,and her the liar hous eulog fam antisemit nant ast thought naz would solv probl,TIN
1996,it noth lik design us hav,TIN
1997,a victim child sex abus hand form prim min what think today,TIN
1998,thi nat disgrac,TIN
1999,margaret thatch wa aw rumo tory mp but noth prob claim westminst child sex abus seny,TIN
2004,dem deb so bad ev lib hollywood wa asham,TIN
2005,thi vil sick pervad every nook cranny socy with estim,TIN
2007,and left think britain rac whilst support barb peopl thi remind country,TIN
2008,interest job watford england thi could gre fit,TIN
2009,thi job op starbuck england follow u turn mobl alert hear job lik a,TIN
2010,regex cheatsheet i hat regex,TIN
2011,just told digit ag outreach suck why could don bet 30sec should,TIN
2012,labo first sil ev nam sil,TIN
2013,oh i know that i thought illeg express rac view,TIN
2014,il bit wher reneg anyth,TIN
2015,doe poor delud snowflak,TIN
2016,that on tot delud snowflak,TIN
2017,but it wok so crim aft hesheit ident fem,TIN
2018,if smel lik bullshit if look lik bullshit then it prob bullshit and tweet,TIN
2019,thi post contain 100 weapon grad bul shit,TIN
2021,what disgust abus amp harass heroin jameel jamil spew amp many oth what dam,TIN
2022,as men rap thousand yorkshir schoolgirl sil as man drink yorkshir tea out the absolv sta,TIN
2023,ther freedom speech uk it platform if speak los job hom y,TIN
2024,thi man idiot it sham stil polit platform,TIN
2025,display year antibrexit bia cal prim min liar it seem chick com hom roost,TIN
2026,our no1 sold shut colo pur whit rec fit window shut a,TIN
2027,with lot new sash window fit op inward abl accommod shut fit a,TIN
2028,beauty ful height window shut cub rang pur whit 76mm louvr with,TIN
2029,lov plant window shut fit brand new apart hertfordshir ful height shut 76m,TIN
2030,easy 123 ord plant window shut windowshut,TIN
2031,fit week caterham surrey from cub rang beauty hardwood shut see ful op,TIN
2032,thi caf styl bay window shut com pur whit it sil tilt rod mov louvr 7,TIN
2033,fuck hel,TIN
2034,yo abud com regard lap dog yap away show respect op,TIN
2035,72000 dea flu 2500 coronavirusupd someth doesnt smel right,TIN
2036,cred europ court hum right lie ruin judg link soro rev op,TIN
2037,jul assang fac 200 year prison decid peopl know hor crim governm,TIN
2038,yo licens fee bbc spend 28million gag ord 500 staff sil us lic fee money,TIN
2039,the poor cit stuck them they dont giv damn liv,TIN
2040,hmtreasury im i want govern protectcash next budget it she stupid n,TIN
2041,just giv suit the uk corrupt see dai apply law eq damn,TIN
2043,the child say how dar you ultim pay thi dont ev ment hs2,TIN
2045,incompet kil moron,TIN
2047,i wrot damn bil berny you also help writ damn rul brok conv,TIN
2048,that trump continu viol,TIN
2049,pelos you dont know shit shit yo scar lady part mayb go back moth sit on out,TIN
2050,i read right wing garb,TIN
2051,and trump doubl pract gtfo,TIN
2052,cbp trump dhd ord,TIN
2053,peopl think good ide murd rap thief fraudst amp terroristsdo rememb when,TIN
2055,borisjohnson strip u eu benefit anyon brain would kep,TIN
2056,the uk reput bast rul law destroy ut sham,TIN
2057,im also sery risk im ter,TIN
2058,just disgust fun ev how many peopl wont be,TIN
2059,just aw dead he al wel giv shit run coun,TIN
2060,bor johnson doesnt know mean commit his lack loyal profess surpr,TIN
2061,rosenstein mad obv stupid decid deton constitut law u adv trum,TIN
2063,he doesnt get it rom liv near u nightm dont liv,TIN
2064,wel said carol the maj sick windrush obsess peopl lik fem unpatriot mp david lammy see rac at,TIN
2065,bandwagon whit ash sark obsess rac amp skin colo her agend focus whit bash s,TIN
2066,ok let put anoth way sark singl whit work class wom say demon be,TIN
2067,they man dist nasty behavio med cov carolin flack blam the,TIN
2068,omg complet wet plac brain,TIN
2069,how know chick eu chlorinated let fac ign rul suit them we,TIN
2070,dhimmy slav enemy trod hors trait scum,TIN
2072,ryanair bos cal extr check muslim men airport bid prev ter attack claim that w,TIN
2073,thes peopl fuck infury i tel,TIN
2074,watch bjp clown tv tortuousit ant nat,TIN
2076,ha ha fuck em fuck u fact,TIN
2077,wher right get steady supply young black peopl zero rac class conscy from,TIN
2078,of cours the plagu metaph encroach fasc and honest could without lit metaph i,TIN
2079,bestresta tap wildbo reind foody meatheav the hairy pig resta,TIN
2080,yeah noth absolv shit show brexit policy spent two year swing dick around mat,TIN
2082,genuin pathet,TIN
2083,sint publ mock unit fund rlb could wors ask sir keir he releas deta,TIN
2084,aipac platform bigot the whol point aipac forc u taxpay support fund subsid aparth,TIN
2085,it funny folk nev talk cub lik castro particul black,TIN
2086,yo confus someon giv fuck,TIN
2087,tot revid,TIN
2088,lol now that pain as,TIN
2089,al max apart night witch lol,TIN
2092,i bet sciencedeny troglodyt ev believ baby hum men wom,TIN
2093,so hypocrit tyr,TIN
2094,mayb bad diseas,TIN
2096,thank rest famy thought i bitch i act lik child fascin anim fol,TIN
2097,youv don dirty,TIN
2098,il put mik penny charg go complet hellscap shit blam him serio,TIN
2099,no quest everyon mind protect sex pred pedophil,TIN
2101,her fac coronavir amp dont form univers healthc,TIN
2102,thi littl nos no,TIN
2103,yal influenz 1 fat rat amp stil kil 12k61k am an coron vir 3 fat rat it,TIN
2104,perv patrol say it tim gym jord resign coach univers depart head ign bad conduc f,TIN
2105,my fath chang party 2016 amp becam democr hat trump much desp rnc stil send j,TIN
2106,yeah mil am that point the point he going fail peopl die becaus,TIN
2107,guy ide anoth whit mal presid mak sick stomach 44 45 enough right klobuch,TIN
2108,dont us struggle support caus it rac get black wom st,TIN
2109,wolf hal book three the mir shit,TIN
2110,ther two sex ftfy,TIN
2111,nobody expect ir inquisit,TIN
2113,thousand peopl uk dying cold fuel poverty blam ow jon,TIN
2114,i think mayb useless eustac tag tad easy i saw clip him,TIN
2115,useless eustac said farm nee plant jun july the clip play po,TIN
2116,thi out blat lie i wond eust hum if wer sur ut shit lik,TIN
2118,ye it lit on lie anoth,TIN
2119,pminnameon play gam word ppl amp busy desp rebuild amp nee pract,TIN
2120,2008 fin crash instig sunak chancellorinnameon look lik ful wet wip ja,TIN
2121,2 impl pri crash rev 3 theyr system weak,TIN
2122,no widespread enough,TIN
2124,revid sess mak pupil think don prop revid go hol put their,TIN
2125,sham real wond govern im toriesout sabisky,TIN
2126,dwpdeaths my solid errol famy my thought nail bastard dwp on dea,TIN
2127,140 dwel 9 1548 tot soc rent equ sre 3year ten presum of,TIN
2128,why on els talk beaut beast,TIN
2129,a decad publ sect pay tory govern pol start sal 2010 23k 2020 23k teach start,TIN
2130,my brain hurt i think wer stuff stick,TIN
2131,in tot norm country journ pract fre i receiv 7 leg let last 2 amp ha,TIN
2132,look lik plan cre elect misinform amp gaslit theyd che bucket cold sick johnson wr,TIN
2138,the let pag ir tim almost nev disappoint,TIN
2139,nop it on say fuck camer creepy bastard thank fuck im shit,TIN
2142,let u fil robertpattinsonneverbotheredcomingtoglasgowtofilmscenesforthenewbatmanmovy hol l,TIN
2143,the damn indict davidsteel today independ inquiry child sex abus david steel knew forty y,TIN
2145,borisjohnson conserv incompet fraud liar brexit latest bor johnson to,TIN
2146,it horr 1 mil uygh brut detain brainwash chin wom rap tort ch,TIN
2147,who evil resist brexit corrupt stopfasc,TIN
2148,good bad ug,TIN
2149,nufc sad hear pass form újpest captain jános göröcs the midfield fac magpy leg o,TIN
2150,tyson fury embarrass deontay wild hand brut beat dur fight pleas wast o,TIN
2151,my fuckin man fuckthesun,UNT
2152,get rid shit spreader dontbuythesun,TIN
2158,at risk delisteddump on person wom compet wom competit,TIN
2159,the welf increas refus work folk fund choos work folk amp many beneficy po,TIN
2160,und soft amp weak crim ardern govt viol drug gang unprec level theyr embold amp total,TIN
2161,im struggling see apart surnam diff rest u indig nzer wom sue,TIN
2162,bbc new larch found jean vany sex abus wom intern report,TIN
2163,bbc new maryland pol off charg murd kil handcuff man,TIN
2164,bbc new uschin trad deal win los,TIN
2165,giv many am access healthc thousand die unnecess consequ ev,TIN
2167,he nee stop wear stupid crap cont box class ringwalk warry en,TIN
2168,whit peopl lik whit peopl hist dumb com,TIN
2169,embarrass excus and also dumb why wear crap anyway cring,TIN
2170,so mi5 think la div job no shit sherlock she think ter co,TIN
2171,wel don it good abl keep emot check id kick kick out,TIN
2172,he kil muslim kid got 7 mon if wealthy famy get away almost anyth,TIN
2173,when shit bed,TIN
2174,when i hear tl say we got scam know damn wel i aint don penny kid,TIN
2175,cal men trash doesnt mak spec dumb twat,TIN
2176,yo fuckin dumb fam,TIN
2177,zwe dit niet die hel vib,TIN
2178,fuck horr mob aint they,TIN
2179,die shit gespeeld kan niet and,TIN
2180,ir kvindelig olhelt hop af protest mod styret jeg er en af mil af undertrykt kvind ir,TIN
2181,hvad himl navn skal det monst til danmark for dansk er og bliv han aldrig,TIN
2182,så svin danmark allermest sur og trist pamflet ekstraebbreak kongefamy til igenigenig men så fat de,TIN
2183,deathinparad star ralf littl drop hug hint fut bbc dram i kil off,TIN
2184,thi simpl athom workout plan help burn fat fast accord person train weightlossjourney,TIN
2186,britain first thug ter murd,TIN
2187,britain first lead wom beat grift paul gold deny ter charg say i am a polit he aint,TIN
2188,pink floyd rog wat narendr mod fasc rac caath legend rock mus read tr,TIN
2193,most am could explain suppos hat cub,TIN
2194,imagin imit black maj adolesc turn around say bitch wann lik you,TIN
2196,the peopl lect cub right clear know anyth lik poor black the,TIN
2197,fuck imagin shit theyr on tyl perry black wom sint revel fuck wig ch,TIN
2200,obsess artic try hint pop said dig hat rath lik ask,TIN
2201,block hat,TIN
2202,i guess theyr mak thi usp freel bad on,TIN
2203,edit mayb could us opportun sing pra freel,TIN
2204,thi disgust on day when mat depart self ab,TIN
2205,the pop know noth backward commun spout ant freedom pro left propagand,TIN
2206,what gb obsess outlaw petrole economyweal kil,TIN
2207,who dumbass keynes whisp trump ear thi presid nee get gr,TIN
2208,berny seny adv speechwrit david sirot lot contempt lib dont veer far enoug,TIN
2209,ar ment retard sery quest,TIN
2210,yo incompet hopeless drunk you cant ev string 3 word togeth and wast 2 ye,TIN
2211,dont underestim pathet old creepy commun,TIN
2213,libert as the market isnt kil coal govern reg tax,TIN
2214,thi guy clown dont ev know theyr che for that old tim left the,TIN
2215,glob sex traffick elit rul class it obvy,TIN
2217,i cant believ quot word god yo arrog peddl disinform evil yo,TIN
2218,it clear left wing,TIN
2219,you campaign new runway gatwick idiot,TIN
2221,oh he ut fail lif,TIN
2222,we already trad deal idiot ev eu subject wto,TIN
2223,whit composit every process rac whit peopl impos rac oth ash,TIN
2224,quid pro quo trudeau get mil bagm chines commun party librano coff look the,TIN
2225,clim chang deb could break democr polit ignatieff clueless stupid a,TIN
2226,op shut,TIN
2227,ter attack kil 10 muslim germany christchurch attack kil 55 muslim ind pol lead mob l,TIN
2228,pink floyd rog wat narendr mod fasc rac caa the legend rock mus read transl,TIN
2229,ind muslim kil street delh scen resembl viol wit guj 2002 mu,TIN
2230,show liv 15 cm parasit worm remov man ey,TIN
2232,in 2016 trev phillip said muslim lik u much new med embrac amp ampl divid crap,TIN
2233,may pet pretend black latino peopl support cant see,TIN
2234,own whiteley chines takeaway hit rac discrimin receiv sint outbreak o,TIN
2235,tomb as khan broth nur jah fath mumtaz shahdar lah 16415,TIN
2237,and cant wait day europ fre corrupt eu,TIN
2240,poor old fem,TIN
2241,anoth bor bash blackford his fac say al,TIN
2242,cw amp tw dog abus endang despit cut nat video teacup dog horr real dog,TIN
2245,im tir sial every day go shit,TIN
2246,im don deal ppl self tox,TIN
2247,fuck miss,TIN
2248,semu kutuk bunkfac sebab mak hamun lgbt lik tf doing you norm weird shit real lgbt n,TIN
2249,peopl sick tir cal rac if vot brexit yo rac if vot bor yo,TIN
2250,sum madam remind mr assang vulnerabilityth step propos interrupt busy o,TIN
2261,he certain fuck u up,TIN
2262,you kil 1000 vuln aust sit cunt,TIN
2263,islam threatens falt believ terr portray hel fir end person lif,TIN
2264,foreign ter ahmad al qaqa idlib syr watch giv speech child most foreign he t,TIN
2268,theyr trash,TIN
2269,gui minha daught say chin bury sent amid coronavir outbreak,TIN
2270,unpopul opin mayb let know if berny abl overcom corrupt hel process amp pick war a,TIN
2271,yo sil act consequ tim start hold peopl respons,TIN
2272,thi judg whol tri process fcking disgrac they ev try mak look lik we,TIN
2273,hat gonn hat,TIN
2274,25k tweet tel pier morg fuck 4k tweet advoc chang med target individ highlight,TIN
2275,thi lit harvey weinstein accus deal sex assault alleg ndassettl wtf,TIN
2276,can help u wer aw wom deny pain reliev childbir seek wom would wil s,TIN
2277,i lov guy damn much,TIN
2278,so ar today pryzm let fuck dant 5sos,TIN
2279,you pand moron dont com say coronavir trump fault you useless,TIN
2280,rememb next tim trash everyon pra him whit black yellow,TIN
2281,1 brut real obam fbi doj becom ter org thread read the,TIN
2282,berny sand say doesnt trad lov let w murd dict yet pra castro noth but blood,TIN
2283,presid trump nam lik popey chick sandwich mou many peopl mak sur ref t,TIN
2285,problem city comply get le money law enforc crim illeg crimin,TIN
2286,i hop hong kong protest good fuck chin if anyon hk read med not act voic us s,TIN
2287,crazy lady part 1 he so hot i want to bit his as amp get lockjaw 3 moody wom knock head whil try to solv,TIN
2288,crazy lady part 2 you act believ everyth i said i guess thos act lesson paid off suck it meryl 3,TIN
2289,you may sidestep trap im railroad as climax writingcommun readingcommun ia,TIN
2292,the eu blunt refus agr tradeon deal ridic demand everyth fish amp ecs def,TIN
2294,the remain dirty trick dept ful swing then the los stil wont cont def be ready anyth iv,TIN
2295,hear brit peopl talk puppet height hypocrisy,TIN
2296,on stupid mom which say lot,TIN
2297,dear whit folk as dec 4 stranger selfy 2 giv ur sm post auth am try 2 e,TIN
2298,most common abus i get selfappoint judgeampjury men us whit demand ev,TIN
2299,also trol ad filthy hairy hippy list filthy peas list ter,TIN
2300,a turn out man rap right 2 assum could rap without fear pun 2 yr the,TIN
2302,doe anyon els think johnson start look lik walk dead look pal very,TIN
2303,we negoty card al just bluff amp blust and brain eith a govern fraud play,TIN
2314,how eu negoty fuck idiot lik in honesty what bunch sil saus,TIN
2315,and osborn ste moneythey hav paid into just lik bankwh bil go,TIN
2316,bor much paid nh far i tak wild guess fuck al tory liar,TIN
2317,gross reckless neglig liarjohnson amp bunch ven parasit that le h,TIN
2318,stop kil every fellow earthl stop it imagin on see beyond ear specy nam hu,TIN
2319,ye stop kil u,TIN
2320,stop kil u,TIN
2321,heck 4 yr hel thi let forget lady riversid clp accus a abus toward,TIN
2322,4yr old baloo cam u fault own liv old kid ok calm dog h,TIN
2324,keep say bath wash cloth wash dish wat plant gard wash car cook,TIN
2326,disappoint deborah dishonest you know swap bad old subsidy system on t,TIN
2328,thes hit diff,TIN
2329,lik bitch im singl us plast,TIN
2331,can fuck thi,UNT
2332,it food fuck on selfy,TIN
2333,adel eat dis bird,TIN
2334,that nasty littl weird,TIN
2335,ffs dont idiot daddy dragon respect peopl going lif chang situ do,TIN
2336,il,TIN
2337,no shit sherlock you seem liest,TIN
2338,it til fat lady sing and throw stil ap how knif crim going clown,TIN
2340,i sery know left wing iv ev known fulltim agit left,TIN
2341,ful lmao,TIN
2342,tak adv teen someth cyn fuck,TIN
2343,53 fuck hel i would guess 35 ish,TIN
2344,do journ smug hack,TIN
2346,it ov joe hav hunt push happy dal nurs hom trad fak mem cornpop,TIN
2347,thes peopl sick crimesagainstchildr uk hom off cont allow sex abus groom child,TIN
2348,foreign aid no wond detery amp grow corrupt ukrain obama admin whil bid,TIN
2349,patron pand pathet sum last night dem deb,TIN
2350,commit dem attempt sugarco real tohono oodham reserv deal sil cr,TIN
2351,the left support freeload fre crap stop theyl riot stop pay tax see psychop,TIN
2355,omg penny coron vir press conf wip nos hand process shak everyon hand,TIN
2356,what a 6 melt school amp get arrest handcuff how ridic cant teach cop som kid,TIN
2367,everyon uk read thread it ut trag we must part rap u healthc,TIN
2368,dear new brit passport neith return sovereign past they look fuck lik old passpo,TIN
2369,leaveeu whin bc eu put first negoty jes fuck christ honest believ,TIN
2370,naz ast celebr disgust the antisemit ev first fem elect hous,TIN
2371,he coon stupid stupid coon thes word andrew sabisk,TIN
2372,bor johnson corrupt gav publ money access govern ev around world on bit sid je,TIN
2373,is littl boy video cal whit peopl rac,TIN
2374,mmmm trad block nuclear weapon could go wrong,TIN
2375,awww moan co stupud bitch get deserv ferrel lefty,TIN
2376,the govern country lawless corrupt,TIN
2385,thi clear confirm amp aid amp guid fulani_herdsmen kil ind,TIN
2386,govern okow cal fg spons herdsm kil u com amp help u wast tim ur kil,TIN
2387,meanwhil niger govern busy partn boko haram ter group op nig,TIN
2388,so sad indee whol world tak act talk it black,TIN
2389,pol tort extrajud kil stain nig socy must address clear ord l,TIN
2390,niger kil u al u wak sad liv dai depress pleas car thi co,TIN
2391,i weep kil hap peopl liv country cal niger do know mort rat r,TIN
2392,boko haram kil bandit kil kidnap kil pol saddl respons of,TIN
2393,he releas arrest boko haram nam repentedbokoharam provid good apart fre,TIN
2394,when ter lead pray just know strike kil many poss every ter,TIN
2395,thi rac artic attempt denigr indianorigin peopl cabinet country,TIN
2397,real why ter gang journ don yesterday now publ aw o,TIN
2398,they us ev want sint useless noth gang publ i,TIN
2399,what expect lib ter they shameless for,TIN
2400,sorry hat mong see peopl kil hindu start thi democ,TIN
2401,what expect ant mod ant trump channel cal bias broadc,TIN
2402,if yo say tory rac yo basical,TIN
2403,ful cont stev ther intellig lif somewh,TIN
2404,if ev deal run in occult someon possess sat on entit,TIN
2406,if simil rul hum liv street,TIN
2410,de leid van on land besta uit een stel naïev idiot inclusief het rivm coronavirusoutbreak coronvir,TIN
2411,i problem soc spit forty y,TIN
2413,peopl bury kid due knif crimear interest bru feel wellheel perm s,TIN
2414,why wok left hat prit patel much it she as wom refus play rac card and,TIN
2415,she rival bor nigel popul polit 40yrs gre job prit let bastard grind y,TIN
2416,i lov way bitch slap jezz red im sur verb smit sting ego mighty,TIN
2417,peopl show support her prit patel al rag sex spit hom off brief,TIN
2419,wow absolv brut respons lefty liar observ hom off their latest nasty smear p,TIN
2420,the eu stab ireland back instead reward ireland play rol eu us idiot brex,TIN
2421,ow jon claim bbc giv spac antiimmigr view fuel rac what mean ordin,TIN
2423,ther trump hypocrit tweet every singl occas,TIN
2424,lmfao comfort smug amp moron coward block fre websit lmfao cuck,TIN
2425,bor,TIN
2426,if 4070 hum end infect covid19 of 3070 asymptom dea rat for symptom,TIN
2428,act fasc,TIN
2429,i real believ am stupid,TIN
2430,i mean asshol know leav peopl unvaccin vuln cost far far far mor t,TIN
2431,cre worst aid epidem us indian,TIN
2434,thi gen mak wann fuck nobody alon forev,TIN
2435,when dat old men real theyr trash young on becaus men trash,TIN
2436,in rac socy enough nonrac we must antirac angel dav noth respect thi,TIN
2437,when nigg cant afford food afford high pow rifl gott ask yourself who provid that shit who,TIN
2438,so sick black am how many afr am butch vary afr acc play histo,TIN
2439,chang lif i cant believ honesty amp op commun possible d,TIN
2440,slavery wors far wors worst osc bait slavery movy ev seen phys emot whit t,TIN
2441,it act suck meet sweet man dont mak pussy whisp you it lik he nic could gre,TIN
2443,what nasty cow prit patel told sir philip rutnam sack off christmas ev,TIN
2444,ful enquiry requir ful forc law requir anyth found o,TIN
2446,seny pol polit knew widespread paedophil westminst turn blind ey it,TIN
2452,holy shit ad,TIN
2453,the old passport black i stil old on thes peopl think th,TIN
2456,every trick anticorbyn playbook unleash half democr est,TIN
2457,the easiest deal hum hist so easy bor johnson threatens walk away,TIN
2458,mik penny coronavir czar you cant mak shit up,TIN
2459,slovak fasc court you vot pivot ballot best rom ant fasc oppos lsnsmarch again,TIN
2460,very sad ther gonn lot busy going work los job,TIN
2463,sat run bollox diesel car,TIN
2464,nobody giv fuck expend belt x,TIN
2465,it fuck flu mat,TIN
2466,it lit flu fuck sak,TIN
2467,it nit pick though real lik cal stupid wom,TIN
2468,absolv disgust a mass fan best world ful support which,TIN
2469,thank god left ridic nannyst the eu impl new rul mean citizy eu memb s,TIN
2470,it trad deal it deal,TIN
2472,bold mov guard tel as wom doesnt understand rac,TIN
2473,it prof stupid barry success in fact stupid asset way t,TIN
2474,thi absolv disgrac law enforc becom jok by act immedy amp decid shut anarch,TIN
2475,behind hous theyr bury 2 peopl died coronavir i ask why insult u amp brought t,TIN
2476,help want want trudeau amp party trait amp theiv gon can spar coupl hour week we a,TIN
2477,anoth lib lapdog trump hat spew democr nar bit dust goodrid,TIN
2478,nat cain suicid qanon wwg1wga,TIN
2479,how horr peopl get away much,TIN
2480,kil im ev reveng punishmentalso it,TIN
2481,being prim min and liar it good look borisjohnson bor lie lying,TIN
2482,lol i think would fair predict no narcissist handl wrong los amp fro,TIN
2483,it ut disgust every singl person country cannot simply turn tap access,TIN
2484,cant believ albert hav riot pend busy what hap go bust,TIN
2485,that far ridic thing iv ev heard get head out,TIN
2487,fuck hel bet word gratitud lad,TIN
2490,if i ev baby dont congrat nigg i fuck,TIN
2491,rap nobody fuck brok rap song i dont fuck with brok nigg,TIN
2492,hahhahahahhahaahh dead,TIN
2494,ring would mean could say shit you chil,TIN
2495,damn lik exact i nee hear,TIN
2496,rest nurs bursaryr i hear god damn thing that,TIN
2497,nunn yawl gotz nothin spast dipleg cerebr palsy unless yal gotz multipl sclerosis shit,TIN
2498,it mat that it wa ev phys cre blacklivesmat wakeup brokenbritain rac rac,TIN
2499,andy fasc ther way hed both pleas someon eat as,TIN
2500,andy ngo hack suck as,TIN
2501,andy fuck pouty atomwaff pal got ass hand fed t,TIN
2502,also fuck smash it gre energy,TIN
2503,bas said fuck amaz support unr keep spreading word il sto,TIN
2504,and that i dont fuck instagram liv,TIN
2505,yo regul remind lot synonym lam crazy ins nut dumb blind idiot etc that ab,TIN
2506,farm got vot ge2019 they suck now,TIN
2507,portug coward scumb,TIN
2508,defr challeng releas 57m defenceless gam bird uk coward hunt fun kil to,TIN
2510,who put 50p dickhead,TIN
2511,from peopl brought the publ sick expert easiest deal hist iain duncansmi say it,TIN
2512,pop frant caut unfair solv aim end conflict israel palestin,TIN
2513,americ nev soc country presid donald j trump cpac summit kick off und ban of amer,TIN
2514,wher proof i mean i fond my littl pony i believ,TIN
2515,exact the hardc tds dem want dea destruct just prov point wth a pot said is,TIN
2516,the easiest way watch network new show theyr liar,TIN
2518,dur deb pocahonta mean amp undisciplin most aim crazy berny min mik they dont kn,TIN
2519,palestin wish on hand crap anoth aft chao dea th,TIN
2522,gut from man lit suck pow man world bul young wom,TIN
2523,absolv nonsens blair inherit ascend amp destroy bas los 5 mil vot corbyn inh,TIN
