idx,text,Task B
7183,obam cabinet wa form by wallstreet mr jul assang fac 175 year u prison the trump admin seek,TIN
7184,the u cas julianasssang extradit leg frankenstein monst dismemb reassembl part of,TIN
7185,why profess cle solv benefit yo bottom lin,TIN
7186,he act prom hypocrit ful display they cant deny policy,TIN
7187,nigg damn tim,TIN
7188,i hat lol,TIN
7189,i wann go in,TIN
7190,why aint nigg dying what didnt right,TIN
7191,god know ded craft i regret i stan rest eat wel,TIN
7192,ind muslim brut assault publ opin busy due covid2019 so hum,TIN
7193,feel lik yo get enough at lik,TIN
7194,anxy as shak,TIN
7195,friend worst,TIN
7196,piss teruk lipbalm asyik hilang,TIN
7197,yal ev miss energy lik shit hap me,TIN
7199,dur covid19 could shut bord country deal break insid theyr bord,TIN
7200,doe anyon els get bor eat askaut actuallyaut,TIN
7201,you wann fat lik me stay 4 lol,TIN
7202,dee wallac return tfw 2020 pursu clan cannib kil the hil hav ey ter pack,TIN
7203,in convers with leigh whannel mark launch univers rev attempt refresh class monst bac,TIN
7204,dar you to say his nam fiv tim you believ bew candym candym cand,TIN
7205,georg a romero novel the liv dead ha been fin amp wil hit shelf jun,TIN
7206,unmiss interview padmashr dr meenaksh jain ind past ayodhy sat hindu respons islam i,TIN
7207,it paty painstak process maraud ferret hindu kil cold blood usu,TIN
7209,barkh dut a young athlet dream ind next abhinav bindr arrest fasc stat dar dr,TIN
7210,delh shoot shahrukh fir 8 round arrest ndtv man arrest alleg point gun pol scroll,TIN
7211,if ndtv any sham would mak rub kum apolog defam innoc an mishr cha,TIN
7212,left whor cal ston slingshot acid attack petrol bomb riot act self def delh can t,TIN
7219,funny est keep mut bts rob stream thes folk jump t,TIN
7220,die vrouw zegt eend wat wat voor gekauwd door erdog om niet de gevang te beland,TIN
7221,iv seen 100 interview fak refug not on syr ev releas,TIN
7222,zero zero zero zero zero zero why zero refug in poland,TIN
7223,that man kil muslim christian us he body spread fak new li,TIN
7224,fak refug look fre lif,TIN
7225,not hard predict org stream fak refug plan mad week agoblackma,TIN
7226,not hard predict org stream fak refug plan wh,TIN
7227,withthesehand remov trump off votewithberny,TIN
7228,fight lik hel presidentsand,TIN
7229,it horr recovery get bitch rip,TIN
7230,lik stop frisk prob worst thing ev,TIN
7231,i trust process i see much trump shit bloomberg theyr lit sam,TIN
7232,yeah that old men,TIN
7233,about mak onlyf helicopt dick dai 899 mon minim 28 dick swing video month,TIN
7234,leav wildl hel alon stop destroy habit keep idiot big city,TIN
7235,left sid im rac,TIN
7236,im fuck cry lmfao,TIN
7237,find sad hum,TIN
7239,if oppos bigot,TIN
7240,start throwing hand,TIN
7241,peopl lik reason wom continu abus men,TIN
7242,homeschool bor homeschool kid ar learn enough meanwhil kind shit ba,TIN
7243,dear internet thi littl 9 year old bul school and suicid but day hear lying amp he,TIN
7248,journ ngo caught produc fak new propagand poor refug drown,TIN
7249,poland show rest europ don acceiv on singl islam immigr it zero ra,TIN
7250,when go us toilet discov dinosa stick in thigh par,TIN
7251,anyon top thi,TIN
7252,the trump campaign pay priv corp spread whit supremac propagand mil am,TIN
7253,the ol contact split ey pain i wouldnt wish worst enemy,TIN
7254,he doesnt noon spok deal amp good ide althou,TIN
7255,idiot suspend par held fin respons injury med reperc,TIN
7256,let fac esco real didnt deserv nasty attack got but buy,TIN
7257,if anyth show fuck twit is kid record wank pict pict girl po,TIN
7258,wtf bargain deal,TIN
7259,holy shit 500,TIN
7260,99 kil innoc peopl hth,TIN
7269,fuck harry styl dant fan stupid lov lady gag club but daddy i lov him shirt tl h,TIN
7270,fuck ye oteh,UNT
7271,becaus fuck you that why,TIN
7272,it fuck portsmou,TIN
7273,fuck veg diet bro tim get back eat but chick,TIN
7274,jord henderson play liverpool los damn,TIN
7275,sint op bord numb refug head toward europ reach hundr thousand thi nu,TIN
7276,man fox town hal bust bloomberg push gun control when he ha arm sec doe yo lif mat mor than,TIN
7277,spreadgtgtget folk glob lib coninclsorosopampglobalistampformerlib think tankviceprezmaxbernierwheretheythinkup,TIN
7278,we ess slav job govern us tax doll fund replac and don,TIN
7279,if think log mak zero sens wer pay foreign com kid ow,TIN
7280,the left turn soc commun,TIN
7281,wtf is on compet min trudea govern,TIN
7282,wel suck,TIN
7283,look wat cfp the black,TIN
7284,obam nev thought id see light day again wel i look window it sunny bitch,TIN
7285,harvey weinstein found guil rap handcuff tak jail he fac 5 25 year prison wel,TIN
7286,stev spielberg daught lik victim child sex abus find heal but porn sex work furth,TIN
7287,my issu box hygy first born sick fee,TIN
7288,they shit,TIN
7289,liv stream socc england npl premy divid 3march2020watch linkhttpstcondofyw2ggo245pmashton u,TIN
7290,esto e fraud,TIN
7292,um common flu kil 64000 am 2018 ye,TIN
7293,thi dai remind support berny sand going sup tuesday ilh om aoc amp rashid t,TIN
7294,soc garb,TIN
7295,the flu kil many am on talk it fakecris,TIN
7296,thi wom know talk about,TIN
7297,ter amm bhi antakwad,TIN
7299,head ind follow i know aw fak new channel help count support,TIN
7300,7 suspect rohingy rob kil gunfight rapid act bat rab bangladesh teknaf cox baz,TIN
7301,he nee hand wuh pol interrog away far far away vult lik prash sib,TIN
7302,anyon tad sceiv hand wash adv,TIN
7303,fak new med lik spread distort real show modij insult presid but modij ke yeh sansk nahin ha,TIN
7304,mod wok 6 mth old sc ord today amp rev cir,TIN
7305,sir today circumst bury head sand r big threat,TIN
7306,they knew vot fuck country hick,TIN
7307,it fuck fair harryandmeg fuck,TIN
7308,no fuck shouldnt fuck lif tak fuck bast,TIN
7309,queen fuck us tak money dont fuck understand ca,TIN
7310,let help fuck fuck royalfamilyfuckoff fuckoff pay f,TIN
7311,and idiot believ lying tory it obvy interest ca,TIN
7312,i feel fuck pain,TIN
7313,ye i couldnt giv fuck thick farm,TIN
7314,you also knew vot want brexit fuck country hick idiot,TIN
7315,what find disturb wil,TIN
7317,lying how could ev suggest thing chrissie wash mou soa,TIN
7321,becaus she lefty lik them ther wouldnt nee be unfortu,TIN
7322,tory defend tory drov anoth hum attempt suicid noth chang eh,TIN
7323,the mand rac fasc lik,TIN
7324,kick tak,TIN
7328,tory corrupt,TIN
7329,2 patel on group tory includ raab truss kwarteng cal as low tax as wo,TIN
7331,sum left thes typ cov rac paedophil gang,TIN
7338,3 it terr disgust mor wrong chin fram xinjiang work governmentl semimilit,TIN
7339,that ant wond wom woodbin could dead eddy decid deploy the labo party would hav,TIN
7340,yo on bitch conserv label lie ont crawl back hol,TIN
7341,form lit caus polit convers wa protest cry blm mov amp let black s the,TIN
7342,al nonconsens sex tre rap new on ye mean ye law approv span govern,TIN
7343,how much evil must end left op bord mex immigr releas despit i,TIN
7344,peopl lik heal ins,TIN
7345,annoy worst uk network ev,TIN
7347,we must ign glob agend stop britain tak right plac world fuck glob,TIN
7348,whilst talk peopl tak piss i disappoint see anoth farm want comp,TIN
7349,peopl britain feel bit il wond get near johnson shak hand,TIN
7351,morn can mla stop thi island nor ireland crap step northern ireland polit a,TIN
7353,you real disgrac opportun you if covid19 vir would f,TIN
7354,get fuck,TIN
7355,thes ar refug invad if turkey decid us milit forc greec forc flood them,TIN
7357,thi jew man celebr islam conquest europ rememb slav trad muslim conquest spain and,TIN
7358,a bad enough erdog support al qaed syr turk pol releas afgh nat,TIN
7359,so nee study prov peopl body butch ad body part born ment di,TIN
7360,turkey seek help wealthy arab country lik saud arab om bahrain ua qa,TIN
7361,ltltkourts turkey attack greec europ uniongtgt anyon pretend understand overt demand op,TIN
7362,a protest vot ukip lik shit hotel bed protest bad serv real t,TIN
7364,if dont fant sing god sav the queen yo wash hand could alway think back jo sw,TIN
7365,tobia langdon uk repuls real reflect left witchhunt andrew sabisky affair bor,TIN
7366,popefr infect christianworld sick soul,TIN
7367,bit petty vindict war crimin whos hand steep blood mil iraq uk milit person,TIN
7368,app man delib block prit access recordsinfo muslim rap gang hóme off coverup,TIN
7369,in californ leg ste walk stor fil bag ful produc amp walk out if want,TIN
7370,who hel nont pol im fury see thi,TIN
7372,yasmin yasmin yasminyasmin ermyasmin ya jest shut christ sak on secondth,TIN
7373,wtf going on a man 8yr old daught grop dad arrest amp charg 4 restrain sick bstard the prick th,TIN
7375,the un everyth ign brut hum right viol palestin ter org,TIN
7376,trump think us flu vaccin defend coronavir we could wors hand,TIN
7377,us soap wat prev spread coronavir such adv com nat bor johnson pm wash his,TIN
7378,pervert amp pedo blu 50 pol off arrest child porn raid thi uk 21st century amp t,TIN
7379,bbc break pol arrest guil far right tommy robinson innoc as mal innoc hang round famil,TIN
7380,thi delicy hillaryclinton depos damn email yum,TIN
7381,wash hand stay away otherss,TIN
7382,ther 300 mil peopl liv rar diseas around commit ens every person li,TIN
7383,yeah bul coalit build,TIN
7384,it rap threat dea threat and,TIN
7385,i mean sand doesnt lik term ber,TIN
7386,iron theyr act sex rac,TIN
7387,sint berniebrosno black support yo grasp it pathet ye support among black ppl,TIN
7388,ua rul off condol dea hosn mubarak,TIN
7389,unlik folk platform amp talk head i dont us account tel story omit lif ex,TIN
7391,shar hel folk,TIN
7392,stay holiday ter attack chancel resign hir rac eug ign flood victim i,TIN
7393,the fuck fuck fuck brexit party fuck respons fuck clusterfuck fuck fuckf,UNT
7394,can act anybody rememb coward pm mr de pfeiffel johnson i wreck brain els hid away i,TIN
7395,i suck econom but thi clown is ev wors dowjon stockmarketcrash2020,TIN
7400,rac twat lik blam immigr everyth nh shit immigr husband left immigr stub toe,TIN
7401,let cal spad spad her thi unh fact inacc rac rant that bbc saw fit broadcast,TIN
7402,thi jut rel vir if get sick zero hour job get paid it inhum it evil,TIN
7403,theres may said tory party nasty party if bor johnson prit patel michael gov nasty the,TIN
7404,prit nam nasty nat prit patel would happy deport moth bul civil serv noth,TIN
7405,bor johnson habit par congenit liar who rub job i say bit me anyon who,TIN
7406,spinm war crimin alastair campbel said keir starm pay lip serv left tack to,TIN
7407,money talk bullshit walksshow u money,TIN
7408,bor johnson last person would want handl nat emerg lif put risk ign,TIN
7410,if johnson los prit patel empow left believ country bal,TIN
7411,thi coron vir threat get blown proport no on scar flu yet kil mil,TIN
7412,a man sex assault 8 year old child fath arrest thi 21st century uk thi 21st century u,TIN
7414,defend bercow whit mal bul clear form black wom who alleg bul whit publ,TIN
7415,the car crash person philip schofield cannot miss opportun knock bor johnson typ itv remain com,TIN
7417,she worry crimin son spout shit and wond labo becom unel,TIN
7419,a soon becom app covid19 not destroy trump econom lib los interest it,TIN
7420,talk show host sebast gork ridic cal remov cpac person didnt lik then,TIN
7421,thi horr,TIN
7422,on volunt explain hypocrisy socy out controvers placard not out,TIN
7423,horr surpr,TIN
7424,it fum today disgust absolv sham piec found spac,TIN
7425,she said whit suprem rac apply form bigotry amp hat,TIN
7426,ov 80 tran folk expery ment heal issu depress why becaus ci idiot writ artic,TIN
7427,you first bitch im knock,TIN
7428,i know twit n shit i leav klass seen hallway wa,TIN
7429,on moth shit raw raid im glad someon hip nam hell drippy,TIN
7430,dont fight ov cu im fuck win tonit los tomorrow,TIN
7431,it sur fuck is,UNT
7432,on thing u tox nigg gon step bitch,TIN
7433,i respect rob nigg lov hoodr so i rob i,TIN
7434,he kil shit,TIN
7435,she hom body 40 nigg know addyooook,TIN
7436,who tf kov art them shit fye fuck i nee part high key,TIN
7437,he review lil woo shit man lil bruh charact,TIN
7438,kob died 26 nigg writ 25th why,TIN
7439,na fam run info nee shit,TIN
7440,stop tryn clap nigg for fuck ya bitch she the problem,TIN
7441,yup look al nigg,TIN
7442,if a nigg say damn bruh she aint got no sisterh want yo bitch,TIN
7443,yo rip nigg kob bullshit but deadass tf vir chin get w2s,TIN
7444,tf heal ins work wtf i aint learn liv whol tim giv fuck bacter,TIN
7445,typ guard bullshit,TIN
7446,obry aw hypocrit know,TIN
7447,u r scum obvy concern ment heal,TIN
7448,ffs david talk head every channel every day talk hyster crazy,TIN
7449,it nonsens affront genuin dis,TIN
7450,thi brut video show carry driv purpos blow smok down carry hors aisha fac flip ov,TIN
7451,and that rac naz going los,TIN
7452,oh wow just pop say hi and ful seem peopl round get mess thing hav,TIN
7453,freeby mass propagand class,TIN
7454,real problem ar shit hit fan i act cury see exact,TIN
7455,not fault big as,TIN
7457,omgood horr,TIN
7458,poor child she look terr,TIN
7459,i agr disgrac tot unfair no doubt win man thought hed chang sex,TIN
7461,do nee know i hop arrang go see grandmoth apolog terr rud behavio,TIN
7465,bullshit he led incompet depart he fir,TIN
7466,press lik want annoy hat shit tweet below,TIN
7467,what bunch mis po fac shit crowth sad littl gang ar who f tel,TIN
7468,who giv shit nobody died,TIN
7469,feck itl starm he wont tak shit without party vot,TIN
7470,mouthpiec murd,TIN
7471,los,TIN
7472,manip bbc shit ask arsehol victim opin,TIN
7473,nobody cream anyth it suck comply oversight compound lack cle,TIN
7474,islam ter rac,TIN
7475,parasit,TIN
7476,you ilk don exact shit country you would rais whit flag subjug,TIN
7477,tot uncal forsometh nee don uncal harass trump support thi not ok shou,TIN
7478,the flu kil peopl,TIN
7479,i think wev found jok s punchlin so i kick,TIN
7480,the vigil kil young wom fuck his as to dea also he is no hero,TIN
7481,with fac lik nee backstop,TIN
7482,could pleas stuf pathet worm hum,TIN
7483,yo diseas,TIN
7484,you prison,TIN
7486,suprem court conserv lean toward trump rapid deport,TIN
7487,divulgamo ant antagonist manobr centrão leiam,TIN
7488,desfaz fak newsfal verdad sobr corrupção de luladilmamostr brasil que está nascendomissão cumprid u,TIN
7489,309 peopl kil offend monit priv prob firm sint serv partpr,TIN
7491,im alway fury many peopl read crap tabloid rath sery broadsheet left right lean wed b,TIN
7492,new research me the 50 biggest tory fail 2020 if remov bor johnson no 10 down street we,TIN
7493,teach mak phys bor crimin,TIN
7494,israel not the democr middl east it ev democr it almost many religy restrict,TIN
7496,bul rac genderhumy method managementpatel both corrupt,TIN
7500,yo whit look lik me belong her rac tend sou afric ins nobody s,TIN
7501,lol jau die syrisch arm sollt dringend aufhör die türkische invasionsstreitmacht rücksichtslos anzugr in,TIN
7502,sigh i liv pod i eat bug i notus larv mush but,TIN
7503,threadobviously reply peopl los head drag queen sexy child sh,TIN
7504,absolv fuck stat pair crispin,TIN
7505,horr ext tony blair fail fuck frank sham u,TIN
7506,absolv fuck pow,TIN
7507,im gonn go ahead say panel incred middleclass peopl sne stupid imagin middleclass si,TIN
7508,cent fuck reliev dream cartoon wok sne at accid trap themsel,TIN
7509,dar grim the weal tax wev got country theyr highest western world institut,TIN
7510,jes fuck aoc know pengest munch,TIN
7511,country lit deport peopl nev liv carib celebr amp polit aud,TIN
7512,ah shit doct should hung fix me,TIN
7513,transl turkey attack europ,TIN
7514,rememb worst thing vir pot hurt oth feel dea pleb,TIN
7515,herm amp pop war kinderrecht nicht die verfassung gehör,TIN
7516,david gutensohn,TIN
7517,commun kil cheeseburg,TIN
7518,it tim europ men wom protect folk,TIN
7519,christ hat bolshevik being stupid,TIN
7520,if theyr going report every coronavir dea i think report every flu dea car accid deat,TIN
7521,classless unprofess thorough hat,TIN
7522,you disgust person you must resign,TIN
7524,if sick tir of wal street billionair pharmaceut lobby heal ins ceo priv,TIN
7525,not anyon car i vot i trust amp mov galv push medic 4,TIN
7526,the ultim class trait,TIN
7527,sint leav off neolib war crimin obam mak 400000 per wal street speech hang bil,TIN
7528,tomorrow afternoon 245 kick 2 entry get afc croydon athlet you push u lin tomorrow,TIN
7529,thi sunday with kick 245pm dont miss,TIN
7530,i cant say clear to nomin say fuck you virt every singl grassroot civil right,TIN
7531,omg lol god damn much mem energy,TIN
7532,berny sand high tax propos uneth evil via,TIN
7533,democr hat democr,TIN
7535,pol off rac ter attack fac disciplin act crash car ha world gon mad,TIN
7536,thi sad scary sad him onset dement terr horr diseas scary u becaus,TIN
7537,break cnn prep indep hit piec trump purg obam holdov resist leak disloy aid,TIN
7538,ye aid week column wrong kind as left wors she t,TIN
7540,thi got sort i cant think anyon effect tak whol scourg head,TIN
7541,to put proverb nail coffin nee endors publ point sup tuesd,TIN
7542,stop moan the vot blu corn tim pul togeth country yo trou,TIN
7543,char car hit i think effect brain,TIN
7544,watch gmb talk left wing opin dont miss chant go bor i wil,TIN
7545,as groom gang victim rap 300 men 15 oft ten ont the sun,TIN
7546,could also thin nee replac left wing lib remain sack,TIN
7548,we car pier mov whol bor bash thing i lik you look c,TIN
7549,im dai remind two complet idiot trump amp penny charg coronaoutbreak,TIN
7550,leav st hol country bet lif want turn country st hol theyr,TIN
7551,oh shut absolv fool you don crap job you want continu crap job you bos y,TIN
7552,ha anyon not u cal rac back prit patel whit man philip rutnam it abo,TIN
7553,sick head year fret thousand kil result dodgy,TIN
7554,campbel keep mou shut he amp blair tel porky subsequ tak t,TIN
7555,resign trudea corrupt just min david lamett told ctv ecoter mer throwing snowbal,TIN
7556,that wom behind look ev dumb pathet,TIN
7557,not afraid al bor mediocr comedy com on mak jok funny you get bil cant mak,TIN
7558,han berny sand unearth 1972 artic beyond gross weird repuls,TIN
7559,mor littl od am doesnt mak list wond why she sit memb u congress but in,TIN
7560,14 indig commun los mil doll opportun taxpay los 70 bil revenu albert los,TIN
7561,pleas play main stag amp also send 18 trait gop refug resettl racket govern sid,TIN
7562,cit west beng list if stil remain sil on sav you i hold guil e,TIN
7563,they perceiv threat wal attack ear us meas contro,TIN
7564,blyd hel mae gavin yn edrych fel taid out,TIN
7565,friend remind stev int took cowl ev though knew bucky going hit fac,TIN
7566,bal lik retweet dont ruin it,TIN
7567,if poc com see show for fre 1218 slav play 2pm 1218 our dear dead drug lord 7pm,TIN
7568,i feel lik fool everyytim i op up im eith list to mad feel stupid o,TIN
7569,it got point im consid stupid as thing lik wear makeup appoint can,TIN
7575,hydrocel i got swin flu i expect worst tim,TIN
7576,thi outbreak coronavir ir appear unhappy coincid,TIN
7577,binky get big turn real loud ungr ter,TIN
7578,soc serv crap loseyourjobin4words,TIN
7579,photo op los talk los lost swinson,TIN
7580,why m luca tak regul flight us do find hypocrit,TIN
7581,evil label attach act find harmfulbot,TIN
7582,wher kar hav bought enough fak sci the coron vir com to,TIN
7583,the book claim tru say god kil every manwomanchild drown allo,TIN
7586,i pretty sur min cod say min cannot lie bul ther high cred evid again,TIN
7587,if i cam ear start heal sick am fre many millisecond big pharm lobby the,TIN
7588,very sad indee but im real surpr bco i predict and ev wors situ,TIN
7589,help her peopl pleas im depress uk becom terr smirk corrupt govern,TIN
7590,he 3 fem man fin sham play femin card bring i,TIN
7591,mat myer right skulk hal congress mut himself god damn vap amp god damn,TIN
7593,erm scot govern think do to tot acc r,TIN
7594,which contin country liv in800k scot,TIN
7595,you mak complet fool yourself at po,TIN
7596,bor pleas get tf,TIN
7597,he problem bercow bul he,TIN
7598,neo marx prec mak johnson neo fasc,TIN
7599,lik trump,TIN
7603,the pm say no on pen selfisol but plan noth work qual for,TIN
7605,so argu sak let acceiv thi in cas ear man los bad what,TIN
7608,lie amp bul get promot cal domin cum unkind get sack welcom bor johnson gol,TIN
7611,just show tory noth bunch rac ars,TIN
7613,also wast tim pmqs pueril child attempt goad sil nam call,TIN
7614,you cant believ crap com labo try cov rap gang an,TIN
7615,ye suzan moor on punch femin act punch grandm hyd park throwing piss academ,TIN
7616,crap labo polit stil go togeth then,TIN
7617,then nee show fuck up i sick hear you would j,TIN
7618,play dumb gam win dumb priz you cant expect progress work behalf conserv,TIN
7619,in on hundr year now known acceiv elect fraud wid spread wast usuk,TIN
7620,dian abbot singl abus polit britain asshol lik find funny on cal,TIN
7621,torybrexit britain 2020 near 2 mil work earn enough meet threshold statut sick pay a low pay,TIN
7622,elit us homegrown cannon fod kil foreign infidel geopolit gam cit blud,TIN
7623,when real bor johnson son draco malfoy he theref luci malfoy bor johnson dea eat no,TIN
7624,when real bor johnson son draco malfoy he theref luci malfoy bor johnson dea eat,TIN
7625,bor johnson fals claim shook hand coronavir hospit paty suggest cyn liar stil lia,TIN
7627,kil 1 refug 11 today ind 5 greec break intern rul continu hum right viol,TIN
7629,disgust fasc rhet von der ley wond farright ris europ,TIN
7634,kil 1 refug 11 today ind 5greecebreaking intern rul continu hum right violatio,TIN
7637,a child drown monday thi europ look lik fac it,TIN
7642,turk hum traffick i hav fil half of europ with immigr wak up europ stop polit allo,TIN
7649,i fuck donald trump nippl crippl ukip,TIN
7650,som peopl lit thought would put nigel charg throw al,TIN
7655,on peopl knowledg talk christ mak man prim min,TIN
7656,wash yo hand say pm if ther on thing bor know someth it wash hand ov year h,TIN
7657,breakinguk fur trap exposé hit latest investig rev shock uk fur trap trad fox snar bludg,TIN
7658,ear lif nev disappoint,TIN
7659,thi fckn mad govern think liv country fil moron,TIN
7660,block idiot,TIN
7662,most peopl dont real berny soc new deal democr his plan would sav capit lik fdr,TIN
7663,thi pic sham democr a journ rev war crim lock behind glass thos respons th,TIN
7664,it start mat i shit um,TIN
7665,jew raab commit treason op peopl uk europ in old day trait impost,TIN
7666,good job ow retard sel newspap mak money,TIN
7667,thi jon sland newspap work mass platform in field employ empl,TIN
7668,pakistan muslim pedophil rap deport why tak 40 year govern act on depo,TIN
7669,sorry i heard im trait thing going perfect mor,TIN
7670,al peopl bitch slavery genocid empir theyv got much say europ amp hav,TIN
7671,the on show display typ breathtak chutzpah highlight plight thousand whit engl folk,TIN
7672,scar go work thi wom child deal singlesex,TIN
7673,we institut sam day deport with perp famy kick em al out,TIN
7674,any crim get deport,TIN
7676,that socal halfwit almost ins wom nee drag out sack ffs,TIN
7677,why do muslim men in the main think brit whit child ar fit on for abus,TIN
7678,so tommy robinson get arrest hold pedo touch kid disgust med blam tommy,TIN
7679,ther could stop jump gun try mak sound wors the peopl w,TIN
7680,no on bul doesnt mat school yo daught go it on busy tak no,TIN
7681,i real dont think corbyn going attack prit around charact count num ter g,TIN
7682,that stupid on put country first espec peopl vot on wouldn,TIN
7683,fool gov off say britain nee farm we liv overpop islandfood sec ne,TIN
7684,to poor girl groom rap gang prit patel sid whing civil serv,TIN
7685,he look slimy wouldnt trust far i throw obvy dont lik wom charg,TIN
7686,how much govern ign feel peopl believ limit polit interf al po,TIN
7687,déjà vu isnt far left ten thousand young girl gang rap muslim groomin,TIN
7688,scum desert,TIN
7689,and med los going stop bul prit patel she exact pay want t,TIN
7690,wher skrypals bor,TIN
7691,wait elizabe war play margaret hodg u remak cent vacu shit whod rath far,TIN
7692,som dang hardright nat pow flaw democr putin mod trump netanyahu bolsonaro dutert joh,TIN
7693,scrim collab black phoenix esport amp aug esport squad mod sabtu 14 maret 2020 minggu 15 maret 2020 liv y,TIN
7694,vir car wash hand want country stop rem,TIN
7695,vir car wash hand want country stop rememb war du,TIN
7696,ol right wors flu peopl round world die flu report,TIN
7697,rememb wash hand beat vir help erad germ wash hand minim o,TIN
7698,ask end foreign aid 146 bil plu foreign aid lun ridic ca,TIN
7699,many thing pmq could spent 146 bil plu foreign aid lun bor,TIN
7700,prep sunday concert ful swing rot hampstead classicalmus,TIN
7701,doe anyon els feel sorry ag grandp push presid it lik poor soul in,TIN
7702,jim acost known hack fortun known clown ev u but i agr,TIN
7704,lik direct toilet she crazy nut,TIN
7705,tiny tempah rol kil me,TIN
7706,non fak new say mak sens they look lik stepford fool mag kag ifbp,TIN
7707,if learn anyth lib thi it built lie lie top lie buttress lie,TIN
7708,you mean lik jlm restart stop left wing pm,TIN
7709,thi funniest video iv ev seen how bar hear song bass spongebob fuck launch,TIN
7710,yet aim remov jvl memb trait labo,TIN
7711,israel soldy op bulldoz ran drop body man ind shel confirm kil righ,TIN
7712,peopl flu i feel shit just wann stay bed noth peopl coronavir i feel shit just wann go,TIN
7713,thi man liv commun colleg,TIN
7714,institut rac tory party someth real,TIN
7716,the dark sid spit im a dement suff margaret thatch los hom help due govern cu,TIN
7717,it absolv disgust may priorit spend publ cash dril amp rap wannab k,TIN
7719,i sick see nont,TIN
